text,pseudo_label
还未完呢，拳师律师团找上她了，后面有人出钱出力，这个妹妹又发博了，准备硬刚铁路，还说列车员说谎。,0
真看不下去了，到处弄脏公共设施，赔钱不是应该的吗，竟然还到处发网上,1
我都遇到过火车上买化妆品的 咋就没有卖卫生巾的,0
是要有人文关怀 但有些人是不是人 现在还很模糊,0
这个报道很明确地说，列车员告知乘客要赔偿180块或者可以选择自行清洗，所以乘客选择了自行清洗，但是我不明白为什么要赔偿180块或者自行清洗，因为我知道酒店、医院之类有提供床位的脏被褥都是有专门的清洗公司的，就算是大小便了我们也没有资格要求顾客清洗或赔偿，为什么火车上就有这种要求呢,0
哪里虚假了，证据呢？哪里没有人文了，在其过程中也考虑了是否承担生理期，也有在帮忙洗，甚至于后续还弄脏了一个床单和坐垫，也帮忙洗了，也没有提出赔偿啊,0
补充：根据当事人最新发的微博，发现其他铁路局的洗涤招标公告和外包明细表，床单限价在个位数（这个张口要价180一条的床单大有查头）。而且兰铁曾经也出过舆论事故，并因此被处罚过,0
补充：可以看看我主页新转发的微博，就知道兰州铁路是有前科的，之前就发过不实通报，漠视人命，嘴脸非常丑恶,1
另补充两个男性案例：近期一个男子在卧铺过道排便，被列车工作人员协助清理，只向被影响的人赔偿了，没有赔偿铁路清洁费。第二个是男子带鸭子，血从上铺流到下铺，污染了别人的衣服，最终受影响的人没有被补偿，列车也没要求赔偿或道歉。,0
？？？乘务员处理的没问题吧，对方说没钱也没坚持收取，还给洗了三次，给旅客准备了热水也去借了卫生巾，不是洗啊，就想问问换成是你还得怎么做才行啊,0
嫌没格局你别坐啊,1
如果真的是通报所说，这女的一而再再而三的污染床铺，座椅，我觉得列车员处理没有任何问题！,0
换成你是列车员，你就鼓励她去坐脏你所以的床铺呗？然后你有格局，给她擦屁股,0
列车上就需要你这种有格局的列车员，人家弄脏几次你毫无怨言的洗几次，一洗一个不吱声,0
我没在这个局干过，但我们这边脏了就脏了呗，关我什么事？旅客要求我就换，到了始发站全部换下去给专门的清洗公司机洗消毒烫熨，我干啥没事找事自己去找旅客拿清洗费？,0
规定拿出来，顺便把烟民烫出的洞一块赔了,0
这床铺被套三个加起来都不值180块钱,0
我如果睡到不干净的床铺，能不能赔我180？,0
根据《 铁路客运运价规则 》，卧票票价已包含卧具清洁更换成本；按12306与国铁规范，卧铺一客一洗，可清洗污损应免费更换，不应额外收费，据铁路部门介绍，普速列车上的床单、被套、枕套等贴身卧具实行“一客一换”制度。,0
别的不说，列车员拿温水洗血就做错了，直接一整个洗不掉了,0
白色布料，有啥是一瓶84解决不了的事，赔个84消毒液的钱就完事了,0
铁路卧铺车票里包含了清洁费，而且就算不是铁路，这种床单问你要180你认吗？,0
怎么抽烟烫洞的不赔呢,1
那应该审计来查查了，这一套三十都不值，采购一个床单180？纠结有谁上下其手了,0
如果就那么一个旧的床单垫子要180的价格，那你更该考虑铁路局的那啥问题了,0
主要是你觉得值180块钱吗？火车票全国200块钱左右都能跑大半个中国了,0
建议铁路向烟人bro收取空气污染费用经血也算污染的话，二手烟怎么不算污染,0
可以看当事人发的证据，情况不属实。,0
还是有正常人,0
根据《铁路客运运价规则°》，卧铺票价里已经包含了卧具清洁、更换的成本按照12306和国铁规范，卧铺本来就是「一客一洗」因正常生理原因造成的污损，属于可清洗范围，哪怕血迹蛋白被温水凝固，也可使用蛋白酶喷雾清除，价格很便宜，所以这个理应免费更换，绝不能额外收费,0
正常来讲是赔偿或者直接走车辆的备品报损，让乘客自己手洗是毫无道理的。,0
bro用烟头烫坏的就不用管了,0
票价里本来就包含清洁费用大哥,0
可以去看当事人发的，这个报道真实性存疑，可能存在虚假报道的情况,0
但事实根本不是这样，这篇文章属于虚假报道,0
哪里没有问题，不提供卫生巾就是问题啊,0
不是赔不赔的问题，从始至终这件事的核心点就是女性卫生没有得到重视！车厢里都没有卫生巾的售卖点,1
这么脏的床单被罩要180，且清洗费在车票里面了，bro对人真好啊,0
就不赔 等官司吧,0
不懂法还能上网真好啊,0
铁路服务不能满足旅客刚性需求，这不属于问题？,0
BrO勒索是有一套的,0
阉人在火车上抽烟把床单烫了洞又不要求赔了 ，男的把刚杀好的鸭带上火车鸭血流一车厢床单还弄脏其他旅客衣物又不叫赔钱不叫污染了？？？？,1
你这种人要是你女性家属摊上这种事 你早激情开麦问候这趟铁路祖宗十八代了,0
你媽當初就不該生你應該把你當月經流走,0
你妈要是知道你是今天这个蠢样子，当初就该让你变成月经血流到厕所里,1
那管不住自己几的乱尿的，管不住自己嘴抽??的也应该给每个人赔偿,1
终于看到个正常人发言，评论里巨婴真多啊,0
你快点变成一滩月经吧怎么你这种没妈的东西也能出生啊,0
死,0
你来月经吗？不来月经在这件事情上没有任何发言权哈，一边去,0
是撒子样子的大脑让你发出这样的言论，本来床单等布料就有损耗，被女性月经打脏了，列车员正常申报进行销毁就行了，有啥好洗的，也没有必要让乘客去赔，不至于。还有卫生巾，几乎所有商场都能做到在卫生间或者其他地方提示如特殊情况可以拨打电话让工作人员送一片卫生巾，列车上居然没有卖的,0
我一个男人，看你说这话，都想骂你，你好像没妈的孩子,1
建议人类不要来月经，整个人类一起灭绝,0
没有任何问题，你凭什么说没有任何问题？你站在什么角度？法律上说没有任何问题搞笑，为什么10 225年12月份男子代鸭子化写污染了多处被褥并没有对其进行罚款或要求洗被褥，南京地铁南乘客排泄铁路有无进行罚款,1
其实我实在搞不明白，火车上卖卫生巾到底妨碍了谁，如果是一位大腿被划伤的男性是你们又是什么态度？一样的血流不止无法控制，一样的身体不适。你们到底在怕什么？女性获得应有的权利对你们来说那么有威胁吗？怕自己被淘汰吗？,1
之前男的屎喷座位上，都没让他赔钱？咋滴男人的屎现在也金贵是吧？男人的屎比静脉血干净666,1
那有本事就出示采购清单啊，看看这又脏又臭又旧不勤换的破床单怎么就值180了。,1
被烟鬼熏上烟味的为什么不赔？,1
假的，官方春秋笔法，床单是她自己用冷水洗的，工作人员让她床单赔180不然就当场洗干净,0
报道虚假的，当事人在整理证据了，碰巧刷到当事人微博，才发现事实这么离谱。,0
不是所有人的周期都是固定的??????,0
一个卫生巾怎么就＝整个超市了？火车可以售卖零食饮料这种必需品不能售卖吗？？？,0
我发现wb的250也很多耶,0
好一个偷换概念，卫生巾品类=整个超市，火车高铁=顺风车,0
偷换概念了 不愧是bro,0
自己差点变成月经了所以这么恐慌么,0
并不是所有人的周期都是一个月，女性平均周期是28天，有人是24.20，也有30.35.这都不一定，就算你算好周期这个月是几号下个月几号，也会因为熬夜，作息紊乱内分泌失调导致提前或者推后。甚至有的女性还会有季经，三个月才会来一次，这个东西没有想象中的那么简单。,0
卖个必需品变成把超市搬过来了,0
来不了月经的人没有发言权,0
月经不调的根本算不准时间，你怎么不说定个闹钟月经还能准时准点来呢,0
我40岁了，周期都不规律，所以只要超过一个月，我都会备上，不过这个当事人是说备用的用完了。如果长途车真的可能用完，年轻女性量大，估计都撑不到两个小时换一次，如果坐十几二十几小时的车，带一包不够用都正常。我也觉得这个火车上应该售卖卫生巾，尤其是距离较远的,0
这个就算是周期正常的女性，也会有可能忘带的情况，百密总会有一疏，谁愿意遇到这种尴尬的时刻？在公司上班期间突然来月经会找女同事借（大家都心知肚明有借无回的那种借），火车上关系都不熟，而且牵扯到休息时间，有时候不是很适合找其他乘客借，如果火车上有售卖，或者有偿提供使用这不是很好吗？,0
bro依旧招笑,0
大概多少天？心里有数？那换季气温骤变的时候，提前半个月来，算不算大概有数？,0
花生瓜子饼干饮料不是基本吃喝哦??烟人到站一定要下去抽的烟不是基本哦??建议把零食和其他不必要东西的售卖都停掉，更要严禁给乘客推销,0
可以卖一车瓜子花生矿区水却没有几包小小卫生巾的位置吗,0
我都不知道我什么时候来月经，你居然知道，真厉害,0
自己带不带和官方提不提供，两个概念,0
每天都要吃喝比月经固定多了为啥不自带啊，饭菜都能不自带，卫生巾倒是不行了,0
你看不到是自备的用完了嘛,0
bro 好懂月经差点变成月经流走了吧,0
br0,0
来人，赐痛经，赐最痛最痛的痛经！,0
火车上连酒都卖却不卖卫生巾,0
花生瓜子矿泉水，啤酒饮料八宝粥，甚至还有列车员推销各地特产和纪念币，你告诉我里面哪些是基本吃喝？,0
正常人出远门都会带够足够喝的饮用水的，火车上就不该买饮料，也不用建饮水机。  很多人出门都会忘带东西呀，忘记带充电宝就租外面的，忘记带餐巾纸也可以买，忘记带卫生巾的就犯天条了吗,0
嗯……列车上提供或售卖卫生巾不是大事吧，和自身备着并不冲突，有人心细记得带有人刚好忘了在列车上能买到不好吗？,0
好迷幻和夸张的发言，嘴巴一张就站道德制高点了，还一副说教的语气。第一、生理期会提前，突然提前个八、九天，谁都预料不到；第二、人人都会有忙碌或者其他原因导致疏忽，谁也不是圣人；第三：几包甚至是几十包卫生巾占不了多大空间，不是整个超市。,1
铁路都说要加了，你反对是有啥好处呢？,0
从来不记日期咋了,0
你就说你来过月经吗？,0
我觉得这也是列车服务预案做的不好，就算不能大批量售卖也可以备一点单片包装的作为旅客应急使用，现在正规一点的地方都有了，卫生间都会贴有需要可以联系什么的。,0
进来之前我就知道是bro了,0
不好意思没法预算，比如我之前都是8号左右来，稳定一段时间后，变成了20号左右，稳定了一段时间后变成了1号，再有一次27号来一直到次月几号，然后当月27号又来了，等同于一个月来两次  有时候就是突如其来的，如果肚子疼有预警，肚子不疼是真的不知道！别再用你的理论来解读,0
火车上可以卖非必须品的零食饮料但是卖卫生巾就是把超市都搬过来，牛,0
所以火车上卖卫生巾很占地方吗？,0
越是出门越容易月经提前或者延后，突然来也正常。真的来了，带一两片也不够，都带一包，因为一时半会结束不了。那车上卖这个给人应急有啥不好？,0
bro说得对，没人比bro更懂月经,0
车上能售卖酒而连卫生巾这种基本卫生用品都不能售卖吗,0
其实有相当大一部分成年女性存在经期不规律的情况，正是正常生理需求，流血不可控，我相信大多数成年女性都做到了提前准备，所以每天来来往往那么多，因为月经不规律引起公共事件的远低于因为高铁抽烟的事例，大家也只是希望妥善解决，铁路方提供后续解决方案，更好服务公众关注正当生理需求，提高关怀,0
有些人三四个月甚至半年来一次，一次来半个月，而且量非常大，完全不可控，怎么预备才能保证万无一失？,0
人家没要求卖酱油和拖鞋啊，哪来的整个超市,0
可以不卖零食饮料，但必须卖卫生巾，卫生巾是刚需品,0
并不是所有人都是固定时间的。有的人多到发洪水，痛到不想活。不了解真实情况，不要随便发表意见。女孩子本来就已经很难过了,0
人家周期不规律，几个月没来月经了，也没有要求把整个超市搬到交通工具上，就只要一包卫生巾而已,0
那么长的火车上放不下几包卫生巾,0
卫生巾是基本必需品谢谢,0
你知道多少女生月经周期是不固定的吗？,0
当事人已经说过了 好几个月没来月经了，才突发情况的，不可能天天备着,0
我的天呐，我们女人哪有你们男人懂月经啊你们最懂了我的天,0
招笑，男人比女人更會月經,0
我就不固定，现代生活压力那么大，不少女性月经不调的,0
当事人说她长期月经不规律,0
只是要个卫生巾怎么就一下严重到把整个超市都搬过来了…,0
br0急了,0
哈哈 哈哈哈 哈哈哈哈 你解决了世界难题，经期规律固定，你赶紧申请专利赚翻了,0
她几个月没有来月经了,0
有个明白人了??,0
br0觉得卖个卫生巾的地方就是超市了,0
周期不准的多的是了,0
不好意思，我姨妈一直不准，心里没数，有时候一个月，有时候两个月，最长三个月,0
没有卫生巾之前不都是用卫生纸吗？可以用质量好的卫生纸应下急,0
我经期在女性里算准的了，但上个月突然提前了十天，这真不是能预估到的事,0
作为成年人，你吃饭的周期，心里应该是有数的。差不多饿的时候，就应该自己备着。交通工具的功能是行驶，基本吃的喝的都不应该卖啊,0
不来月经的搁这超懂月经的,0
人家带了备用的 只是备用的也用完了,0
你来过吗我就问你,0
护手霜和上海那个面霜都能买，卖这些东西的时候怎么不见你说把整个超市搬上来2026了还能见到原始人原始社会,0
卫生巾好大的排面啊，居然可以把整个超市搬过来，你家楼下的便利超市是只卖卫生巾吗,0
好女人！大国有你这样懂事的女人真是幸运,0
你回去问问你身边的女性朋友，亲戚和家人。,0
卫生巾就是必需品！,0
她这个事在我看不是卫生巾的问题，主要是这180块钱不应该收，发改委有规定，这个属于包含在票价里的内容。而且卖个卫生巾在我看来也没啥，还能增收。,0
br0太了解月经了，这么好的事该赏赐给你才对呀，赐你量最多的月经,0
bro虽然没来过月经，但论起月经可比女人懂，哈哈哈哈哈,0
知道自己坐车会饿就该自己备好吃的喝的，火车上卖什么卖？不知道自己会饿会渴吗？,0
保胎技术还是太好了,0
虽然我没长子宫，但是没有人比我更懂月经??,0
没有经历过就不要批判别人,0
看来她来不明白月经，给你你来吧懂哥,0
照你这么说火车上啥也别卖了，都自己准备好了就行了,0
明知道出远门会饿，为什么不提前吃好准备好食物？为什么铁路上要售卖盒饭甚至零食？,0
redmi k80 pro,0
得了吧，高铁上瓜果饮料哈根达斯都有，你和我说这是长途旅行必需品吗？不吃零食没有任何人会受影响，真忘了卫生巾是确实要有麻烦。我随身都会带，但也不妨碍我认为高铁应该贩卖，怎么也比哈根达斯有必要吧？,0
有些人会不规律的，我同事就是不规律，有时一个半月，有时两个月，还有时一个月两次，她怀孕了自己也都没发现，肚子疼去医院检查了才知道有宝宝了,0
brO一手偷换概念,0
卖烟的时候又不说话了bro,0
我觉得车上不应该卖东西，长途旅行都应该保证自己的吃喝,0
我高中一个同学，半个月来一次，一次来2星期，经常疼的嘴唇发白，还有一个同学，一年只来2次最多3次，根本没有具体时间，当时听她说都震惊死了，其实她也不知道多久来一次，就感觉这一年就来2次，当时好羡慕她。,0
你每天都要用卫生纸呢，你就从来没有忘记带过卫生纸？,0
计算不了，谢谢,0
棋牌充电宝甚至槟榔都有，结果要求卖卫生巾就是要求搬整个超市了，你的逻辑在哪？,0
要求售卖已经是女性最低的要求了，不敢奢求免费提供,1
我也觉得火车上这么多人 按道理借也能借到一片,0
我认为应该每个100米有一张姨妈巾而且是以全国为标准,0
火车上卫生巾卖的还很贵，15块钱几片，一边挣旅客钱一边贬低旅客,1
其实很多商场的卫生间都提供一些必需品，纸巾卫生巾橡皮筋什么的，用来应急，列车上居然不提供,0
我寻思没有即使火车上不卖卫生巾，医药箱总是有的吧，哪怕看到血迹后给人家一个尿垫什么的让人家垫着，再不济还有垃圾袋，但凡考虑到人家裤子以及是血且还在出血，给个东西垫着。人也不会弄脏后面的几个了，说白了就是没有管人家，把人家赶下去之后让人家怎么办呢？一直站着吗？,1
当事人有没有自备卫生巾和列车有没有提供卫生巾有0个关系，同样卖卫生巾和考虑营收/要挣钱也有0个关系，楼里那个苍狗可曾读过什么书,0
事实就是当时火车上根本找不到卫生巾这不是必需品吗，偌大的火车一包都没配备，烟倒是卖的多呢,0
你肯定喜欢吃海底捞吧？,0
据当事人称，铁路回应有不实信息。而且可以看看我主页新转发的微博，就知道兰州铁路是有前科的，之前就发过不实通报，漠视人命，嘴脸非常丑恶,1
洗了两条床单算不算服务？也没收钱也没啥的，不满意的点在哪里？,0
不是说帮她洗被套了吗？这叫没服务意识？？？？你平时上班是如何服务客户/老板/领导？,1
列车还需要提供服务？这真是你爱坐不坐了,0
确实，我们这里很多商场的女洗手间门后都会贴，如果有特殊需要，可以联系工作人员，免费提供卫生巾。卫生巾对于女性来说，就是必需品啊。,0
说实话，我都不指望火车高铁上免费提供卫生巾，只是希望火车上售卖，他们都觉得我们女性无理取闹,1
但是吧……很多商场里这个提示语指的其实不是卫生巾，因为我确实问过,0
确实，坐了很多次火车，那些卖玩具耳机牙刷的之类的，经常就是喊了一圈无人问津,0
因为真正买的人太少了呗、而你说的反而很多人买、如果这事情是赚钱的、别人抢着干、这也恰恰说明了不带卫生巾的女性是极少数、,1
对了，就是这点完全不能理解。列车员腿着一堆吃喝的东西大力叫卖的时候不说东西碍地方，实际就是卫生巾不赚钱呗。但是有一说一，你就是车上备一包卫生巾零散着卖急需时候也可以啊，也不怕过期，怎么就影响你日常做的其他生意了呢,0
吃的喝的不是人的必需品吗，你这段话说的好像女人不需要吃东西似的,0
禁烟是禁不了。卫生巾是男人用的嘛,0
不是开始卖，而是必须卖，以前有的火车卖，有的没卖，但是这件事后，全部的火车都必须卖卫生巾，防止再发生这样的事情，感谢这位女士。,0
山东有,0
非常感谢,0
请你举出任意一个国家的公共交通系统，规定必须得售卖卫生巾，卖完了都不行的不奇葩的例子；,1
什么时候可以停止我女我也,0
有好男人加你吗,0
？你真的来过月经吗？？,0
事发时间是已经熄灯的晚上，都睡着了，没法把人叫醒要wsj吧,0
继续跪,0
那恭喜你，成功的取悦了男性。,0
飞升成功了吗我女我也,0
刚来第一天量最大，卫生纸哪够，而且她都把衣服垫在下面了，你觉得卫生纸能行吗？,0
确实费解 ，首先出门一般会带着卫生巾以防万一，因为姨妈真的会喜欢出远门的时候来，一般还会带一次性内裤，最不济纸巾肯定有，第一次给人家弄脏了就得感觉非常抱歉了，要么就先垫厚厚的纸巾，要么求助车上的女性旅客或女性列车员，一般都会帮忙的，不论列车人员处理的是否有问题，联续弄脏多处不理解,0
又女也我也，你是女的你以后来月经就用卫生纸,0
（谁来上图）你怎么知道我是男扮女装·JPG,0
精神男人也來支持了,0
是没看完吗女士？都睡着了怎么要,0
如果你是女性，那么你可以不跟团，但是不要在其他女性争取权利的时候展开“我女我也”这种风凉话，如果你是brO，后面的保温杯别拿下来,1
要是按你这么想，事情就不会发展到现在了，同是女生，不能看到她的艰难和无助吗，什么时候停止我女我也,0
我也在想，如果换做我，长途列车，如果真的没带卫生巾，我会怎么办。我这种性格可能我不敢坐然后赔钱，我懒，我选择赔钱。如果没有换洗衣服就多弄卫生纸垫着，站着吧。没办法。其实自己生理期大概时间应该备着。像我这种必须带着，因为甲减免疫力不好，生理期没有时间可能突然就来了。尴尬,0
有bro私信你了吗,0
微博难得一见的正常女性,0
这评论区好吓人，我的天,0
量大的时候纸巾也防不住的呀。。。你竟然是女生吗我不能理解,0
恭喜你，肯定有很多好男人私信你吧这么顾全大局的??,0
大哥哥，祝您可以早点做自己吧,0
你们文字看完再评论行不行,0
对的一个正常人不会带着血裤子到处跑,0
来过姨妈吗？,0
文中写给她找了卫生纸，估计妹子是个血牛,0
你是女生吗？,0
俺是老猪俺也觉得猪肉好吃,0
有问的，也有问车厢了，也有给卫生巾了。,0
你有优越得很 但愿你的人生永远每时每刻都顺遂都正确,0
正常女生出门包里都会备着几片卫生巾护垫的，卫生纸更不用说肯定是必备,0
br0小时候尿床把纸巾垫在床上床就不会湿,0
人家都做了,0
钓到鱼了吗,0
我女我也一律打为男的,0
恭喜你呢，打入男人内部了。,0
飞升了吗？每个人都有不一样的情况，别把自己代入，你能代入的只有经期不会通知你它什么时候到。当然，很难相信你有经期,0
因为这篇报道完全不属实！！,0
别人在争取女人人权，你在这里“我女我也”拖后腿,1
有些人月经量特别大纸巾完全不够用,0
最后一铁路的人也没有给她要到一片卫生巾啊更何况她一个人,0
建议你来月经不用卫生巾尝试一次呢,0
有男人加你了吗,0
你不知道有卫生巾也会侧漏吗？,0
女生第一天都是垫着衣服睡觉的都会弄到床单上，卫生纸哪儿够啊，很厚的卫生纸也没招,0
对啊，问车上其他女性，一个个问，难道问不到,0
反串是吧,0
飞升了吗,0
说明当事人很难受啊，而且如果铁路方能事前做好应对这些事情的准备，当事人就不会这么狼狈了,0
我女我也×男演男信√,0
看报道，提供卫生纸了！估计这姐妹量太大了！,0
我二舅年方50，家里有矿，出门大金链子大金表，就缺个给他洗内裤的，我看你挺合适,0
虽然…但是…你的重点已经偏了。卫生巾是应急产品，为什么铁路不卖,0
精神男人也是男人bro,0
出门准备不周全是很常见的情况吧毕竟不是在家里,0
应该是睡着了 没有感觉吧 本来有时候月经不规律就是会突然来啊很措手不及 你是女生应该更可以理解呀....,0
量大的那两天不行。。。。卫生纸能吸收洪水吗？,0
你继续,0
不要求你为自己的同胞发声，但在这种时候装理中客拉偏架真的又蠢又恶毒,1
你是个伥鬼，谢谢,1
真是太可怕了，这个评论本来是随意的一句评论，包含着自己不解的评论，因为如果来姨妈肯定要体面一些的，因为是女性才觉得自己会想尽办法不尴尬……不理解为什么喷，真是疯了一般！！！！没有任何性别色彩的话！！！！！！！！,1
因为她一直在洗床单没空跟人去一个车厢一个车厢借，你看不懂？你是女生里智力很低的那种,0
我是女生，我觉得你有点子问题,0
你要真是女生说不出这种蠢话,0
想骂又可怜你，不知道你是真女还是装女，真女就太可悲了，还不如是男装女。21世纪，你这意思是不是出门要把全身家当都带上，毕竟要做好准备嘛，头上顶俩饼手上提俩桶，毕竟人要预想到自己会饿会排泄，绝对不能麻烦别人哟。而且这p声明里可是说列车员遍寻列车找不到一片卫生巾，这女生是能凭空变出来？,1
有好男人加你吗我们在为女性争权益的时候你可以不报团不跟团，你来句“我是女的我也觉得”这些背刺的话是啥意思你能去泰国走一趟吗别跟我们女性一个性别丢人,1
