text,pseudo_label
对的，木薯本就是多种常见食物的加工原料，处理之后都是ok的，这次就属于以次充好了,0
有的,0
我真生气了。,0
没记错的话煮熟了没有，木薯生的有毒，,0
是这样的，就相当于你买猪肉制品，给你换成了鸡肉，吃不出问题，但是货不对板,0
没毒，只是偷工减料用了便宜的原材料，只是欺骗消费者，没有食品安全问题（应该吧）,0
吹牛逼,0
安徽高启强，你以为呢,0
那有点恶心了 凭啥小羊高人一等 赔不起就不赔了啊,1
会说你就多说 爱听,0
她说退一赔万就能退一赔万？我要是个卖假货的，我说有胶退一赔地球，到时候我真有胶退一赔地球？,1
所以有胶嘛,0
假一陪万，还是胶一陪万,0
所以胖东来一份粉赔一千块真的是老板会做生意，也是有良心的。,0
赔不起，购买的人太多,0
不足500按500赔,0
法律是底线，不是最高上限，就算有胶他们也可以什么都不认，只赔500，法律底线是这个，你也没办法，别信那些所谓的赔万的口号，真有问题法律不支持,0
因为木薯不算有毒有害不影响食品安全，只是按虚假宣传，退一赔三,0
现在是红薯粉条没有红薯，不比什么胶还要严重吗？你怎么洗地的，雨姐这个钱白花了,0
说了有胶赔万，也说了假一赔万。先理解假一赔万这个词汇吧,0
按法律来很难么……,0
你说错了，不满一千的，按一千赔，不是五百,0
人家最后不是说了，会以zf机构为准？你在急什么,0
不写入合同也可以生效的，但是退一赔万，倍数太大了，不知道法院会不会支持,0
最少赔500，还能赔10000,0
食品类不是假一赔十么,0
说的是不含胶，含胶的话假一赔万,0
人家没有叫你家人们,0
怎么还有口音啊,1
那她应该赔500才对！,0
不是宽不宽容的事儿 雨姐我也挺烦她的 刻板化我们东北人 但就事论事 国家法律规定的退一赔三吧 然后她说有胶赔万 这个也是有视频的  咱该咋是咋呗,0
还是消费者宽容啊,0
那是合肥的爹,0
确定不是说的有假吗,0
哈哈哈哈反正一个字都别信就对了除了标点符号都可能是假的,0
如果有胶假一赔万,0
问题是人家店铺标语是Ｘ克官方授权，100%正品，假一赔一，这的有多牛,0
我跟她也是老乡，所以觉得丢脸,0
虽然我跟她算是老乡吧，我也不太喜欢她，让很多不了解东北人和东北女人的人容易产生误解，一天天呜呜咋咋的，闹腾,0
这个平台就是售假平台啊！,1
说她给东北人丢脸,1
没说她代表东北人啊！这理解能力太强了,0
你知道东三省多少人口吗？就敢说海量个例，还是你亲自统计过,0
海量个例,0
哈哈哈，鬼才,0
哪个个人也代表不了所有东北人,0
你去香港。,0
好的，谢谢,0
简单说 就是  “食品安全 ”,0
以前其实有的 但是发现xxx添加剂 现在没了 你有空去香港玩 可以特地去超市看一眼 看不到了 什么乐视薯片 更不用说了  咱这大牌子很多都没有,0
虽是一国但是两制,0
猜猜为什么一天下来0人赞你我两条一个21赞一个17赞。没点13数，本该觉得丢人适可而止还要跳出来继续秀智商,0
那你多吃点,0
你可真是会避重就轻，虽然在符合生产规则和健康前提下少剂量添加是没问题，现在是说她夸大宣传，而且她这根本不懂食品安全法就在那胡咧咧，见过捧臭脚的没见过你这么无脑的,1
在符合生产规则和健康前提下少剂量添加是没问题，现在是说她夸大宣传，而且她这根本不懂食品安全这款就在那胡咧咧，现在被打脸了吧,0
吃不吃的死跟有没有毒是2码事可以吗？,0
羊都不赔，1都没,0
理想是美好的,0
指定得赔钱啊,0
要是能赔钱倒是还不错,0
食品安全在中国无解，因为有特供产品，权贵吃的什么时间和普通老百姓吃的一样的时候，食品安全就解决了,0
你觉得呢,0
陪三不是直接退金额吗再发三份那不哈皮吗,0
赔钱吧 难道还赔红薯粉,0
制售有毒有害食品确实罪大，但跟本案有关么？你想说这粉条就是有毒有害，因为相关部门腐败给掩盖了，是吧。你有检测报告检测出有毒有害成分了？相关部门，当事人，第三方这么多人的检测报告你没看？在这含沙射影，明眼人都知道你是干嘛的,1
在制售有毒有害面前，食品类的虚假宣传算个屁,0
国外杀人交钱就行？让我长见识了,1
激起您那敏感的爱国情怀了？麻烦您解决一下食品安全问题呗,0
你好像那个质检人员哈哈,0
知道你想煽动什么，想搞中国的舆情事件，起码先了解中国相关法规。这个是虚假宣传，不是制售有毒有害食品。,1
张口就来啊，你对赔偿的做了质检了？说话一点证据都不讲,0
奶茶用的珍珠都是木薯粉做的吃死人了吗,0
没办法呀 法律规定咱们国家的食品安全很多很多基本规定就那样 大家不超那个底线就行。比如前段时间说那个防腐添加剂吵来吵去，大家骂月饼骂厂家。可是国家监管部门不是又美美隐身了。,0
现在不还是两制吗  你等一制的时候   你好好体验体验,0
查的动吗？,0
165万对于这种千万级的大网红不就是一天的收入吗？,0
调查一个月不如记者一整天,0
就是这样那些人才疯狂带货，反正随便喊喊几百万就赚回来了,0
内地只要不吃死人就不算事,1
你去香港,0
无法无天,0
内地很多食品都谈不上安全卫生，甚至票子给够了就等于安全卫生了,0
兄弟，解释下，啥原因，不健康么？,0
珍珠奶茶里的黑珍珠就是木薯粉做的,0
哈哈哈哈第一次听说木薯粉能吃死人，那甜品里的芋圆和珍珠啥的都不要吃了，木薯淀粉也别吃了。,0
都是中国为啥去你们那还得办这办那的,0
就是假冒伪劣虚假宣传啊，夸大是夸大功能功效之类的，这是木薯粉假冒红薯粉,0
哎…我们压根就没有,0
这种是夸大宣传，虚假宣传。还有就是价格不匹配。但是在程度上没那种用不健康原材料的严重。,0
纯纯诈骗啊，名称叫红薯粉，配料表写了只有红薯，成分一查0红薯粉。。。这是诈骗，高级的虚假宣传,1
你是真逆天，木薯粉吃死人？真就无脑为了怼而怼张口就来？把红薯粉换成木薯粉，就是夸大宣传以及价格上不匹配用低价材料宣传高价材料夸大售卖。这并不是那种把正常宣传的材料换成无法食用或有害物质或不适于食用的材料，那种才是更高一级的恶劣处罚才更严重。你是真不懂还是就那么爱无脑怼？,1
会吃死人还不恶劣？,1
一国两制,0
羊都没赔过,0
内地食品安全法形同虚设,0
民贱如草啊,1
??有什么神经搭错吗？,0
我觉得再两制，老百姓的安全也得第一位。,0
要有一个过程的,0
你们是??,0
一国两制。还有我们的食品各种添加剂，除了老百姓在意，没有人会在意。老百姓也不会去检验，然后就没有然后了,0
为啥香港没有伊犁蒙牛,0
你在哪个灯塔国家看到不是赔钱了事？资本主义国家更是大律师团护航，杀人花巨额保释金,1
口头而已，真把自己当人了啊,0
我的也是，挂羊头卖狗肉，我投诉了后台强行退了四十，我不同意他们私自操作了,1
这倒是也不属于食品安全范畴，而是把木薯粉虚假宣传说成红薯粉。,0
都是中国为啥不同，必须一样,0
那是香港，内地情况不同,0
主要太多了，总是有人发,0
我也是，真的看不了一点,0
北方敢整这个造型的没有善茬,0
我直接屏蔽,0
你以为是理财，本金拖你10年,0
他要是卖的便宜，遇到用粉条的饭店会买这么多的；只是平台没把那个流量推给雨姐。现在很多商户的用品都是网上购买的。,0
打假人呗,1
谁会买几万块钱粉条子,0
我没买，小红书看到退了优惠券，要自己去找对应店铺。,0
痛失拍大腿,0
没有,0
你怎么那么不要脸呢？没有500按500赔他赔了吗？?,1
人家确实退一赔三，为什么非要黑？,1
后来买了雨姐吗,0
你是小羊哥的死忠粉吧,0
，相当于没退,0
他退个毛线，不够500也要按500赔，他赔了吗？处不要脸。,1
没有呢,0
快去看看，我的消息有用的话，你退到钱记得分我两块,0
是无门槛优惠券,0
没有退,0
他退的时候我就在想要不要买雨姐。,0
也进商超。比如磷酸盐，水产品常用添加剂。toB会写在配料表上。toC就可能不写（因为消费者不喜欢,0
大人就这么地吧，爱吃啥吃点啥，小孩子看着点,0
好奇一下，应该是不进商超or未上市公司吧？因为如果被友商针对，这个把柄太大了直接停产停业，数量巨大会坐牢的，太不划算了,0
可是粉条这种东西 哪有品牌啊,0
哈哈，都一样的,0
等我在市监局有人再说，毕竟老板一定有人,0
我之前工作的公司，挺出名的水产企业，主播贴牌的产品乱写，因为主播团队不让写那么多添加剂，领导就让直接删配料表也不换配方,0
有明胶才赔,0
自己去检测然后起诉要求赔偿可能多一点。,0
我们是有一房多租的情况，警察说这是典型的合同诈骗，但是迟迟不立案，到处踢皮球,1
1818也不管,0
1818黄金眼啊,0
新闻不是说了她知情吗？不然怎么罚她。,0
你也是木薯粉攻占大脑了,0
头像都印袋子上了，她没参与,0
所以呢？她很无辜？,0
你算说对了,0
安徽这地方人真恶心，羊羊羊都这样了，还全省保护它门,1
早就有了,0
你收到了？,0
店铺是俊辰业务吗,0
我买的那家也是,0
一码归一码，人家担心的是能不能吃,0
配料表造假不是问题？,0
我加珍珠非常讨厌芋圆,0
我还就从来不吃芋圆,0
木薯有毒后期加工成粉的木薯粉已经没有有毒成份了，木薯≠木薯粉,0
木薯粉是后期加工去除了有毒物质，那个“学会自己疗伤”自己没有常识不懂装懂，你买的是粉不是生木薯,0
之前出的检测报告并没有食品安全问题，主要问题还是厂家配料表作假，生木薯才有毒 难不成你生吃？,0
真的很难煮熟，但是我吃了我妈做的饭，现在也没啥反应吧。都买一年了,0
但是很难煮透硬啊。所以不能说她没毒也不能说一定有毒,0
没熟透的有毒，只要确保去皮并且蒸煮熟透就没毒,0
啊乖乖，真有毒吗？我刚从超市买了包木薯淀粉我百度一下去,0
木薯有的有毒不懂？没常识？,0
你知道木薯是什么吗？就说无毒？,0
虚假标注就是食品安全问题,0
市场监管局并没有说粉条检测不符合食品安全标准，所以应该不适用赔十。,0
“退一赔十”则适用于食品领域，即卖家生产、销售不符合食品安全标准的食品，给消费者造成损害的情况。 也就是说，不管商家有没有构成欺诈，只要他生产的食品不符合食品安全标准，并对你的身体健康造成影响，则都应该“退一赔十”,0
原来如此，理解理解,0
如果在你心里，她的人设是个有良心的商家、家人，那肯定塌了。但在我心里，她是【气血女王】，而且我没买过她东西，也没打算买，好像关注都没点过，哈哈，所以在我这没塌。我就不喜欢在直播间购物，我是个有思想的人，想买啥我自己不会去购物软件搜吗？干嘛网红推啥我买啥,0
不讲良心，欺骗家人，欺骗消费者，都还不叫塌呀？,1
买一千万的粉条更好,0
还有什么可以相信。。。,0
还有一句是 “增加赔偿的金额不足一千元的，为一千元。” 这个没说是三倍还是十倍都是1000,0
没吃了已经，已经打算扔了，因为煮过两次口感都不怎么好所以直接不吃了,0
我的也是，去年十月之前，不给退，我煮了两次，还有好多,0
有时间限制的 商家给我的回复 如果你的在这段期间的就可以赔 “亲亲您好，很抱歉您的订单不在赔付范围内，经相关部门调查，不符合标识产品区间为2023年10月1日至2024年9月30日，感谢您的进线，祝您生活愉快。”,0
我没买，我不喜欢她，所以也不看她直播，借这个机会你就去找平台，过这阵子你自己单独找，肯定不能管，就去找快手客服，如果赔你可不是28块钱,0
你退了？快手从哪里不管。再等等吧万一后面还能赔偿呢不赔算了就28累了。我都买一年了订单都没办法退了,0
说对了，过年做汤底的都不敢弄太多,0
找平台申请售后,0
蹲希望能有结果吧    雨姐直接把三只羊的事情给压下去了,0
蹲一个处理办法，我也买了,0
有订单但是怎么退啊商家不回,0
嗯 刚在其他网站可以打开了 谢谢??,0
网暴本来就不对，退一万步说被侵权的是李荣浩又不是你，你站在什么立场去骂人家网暴都能被说的这么合理这世界真是癫了,1
人有问题就得??，纯?,0
等于是单的粉丝私信后台连着他的家人一起骂就是对的了呗  同样人心都是肉做的  你被骂了你能急眼别人不能急眼  还要受着是这样的吗 查看图片,0
别跟他讲道理，脑子瓦特了，你给他讲东，他非得朝西，纯纯搞你心态，就这么恶心人吗单依纯的粉丝，为了维护自己主子，开始了，果然有其主必有其仆,1
李荣浩以前抄袭也挨骂了啊？看来你关注够久啊老登粉丝，再见不送,0
哎哟我也是操了，我这评论说的就是单有问题，李荣浩也不是好鸟，这还不就事论事啊，你自己回复我的评论，@我，现在反过来还问我跟我讲话了吗？ 别来回复我了，太晦气了，我跟个单细胞在讲话，进化还没完整？,0
我本来也不想跟你讲话啊，自己上赶着来跟我对线，觉得自己占理了我说你咋了，想做别人爹教育别人，就做好被骂的准备，别摆正别人，自己屁股歪了看谁都歪,1
依旧人身攻击，我跟你谈辩证，你跟我人身攻击，你什么时候把自己的脑子掰正过来再跟我讲话吧？你先把我的问题回答了，行不行？依旧查主页，我说我这是新号，你信不信？,1
辩证一点，非要是完美受害者才配维权吗？他之前抄袭的时候没人骂吗？都被骂了那还还说啥啊？你的意思是，一个人之前有过一些问题，他就没有维权的资格了，是吗？什么强盗逻辑？,1
依旧性别对立，依旧爹味满满，你们能不能有一点自己的思想啊？他难道不是前辈吗？他不配端起前辈架子吗？单依纯她有什么资格叫自己创作人啊？李荣浩自己都不喜欢李白这首歌，单依纯还非要在那瞎改，没办法呀，老实人生气了，还有你的回复，我有错，你之前也犯过错，你就不配维权，这是什么强盗逻辑？,0
不喜欢“魔改”第一次音乐节就可以禁止哈 不用当bz还立牌坊 怪馊的,0
呆子就是呆子，纯nc,1
就是要让你家德不配位的名誉扫地哈互联网对钕的还是太宽容了哈,1
那你倒说说互联网有啥回忆，都发出来看看,0
搞笑吧孩子回来你底线被打破，你也不要生气，不能生气，不能有情绪，不能表达出来，是不是单依纯粉丝你自己心里清楚，还单纯路人,0
热衷于造神灭神，因为现实中装孙子，网上当大爷呢,0
留点脸面不知足粉丝上赶着要单被告,0
没有没有  我也是大学生  你的意思是你可以骂别人  那就是别人骂不得你了呗  你自己没看看我给你发的图片  纯妹妹的粉丝这么有素质的吗,0
看你这么骂，感觉你最多小学智商吧。,1
尼的??跟名字绝配配～,0
讲话怎么恶心祝你全家4??光,1
继续闹呗，我看看天厚以后能出什么原创路人见之唾弃的玩意儿，就粉丝喜欢捧,0
粉丝都骂到后台了  骂自己不说  带着他的家人一起骂  人心都是肉做的  带着他的家人一起骂  都是普通人  急眼也很正常  换你我相信你也受不了  那可是成百上千的人,1
这种二B你跟他讨论什么,0
为啥都是发文批评，都是口出恶言，一个在你这里就是“煽动性引爆舆论”，一个就是“没指望通过舆论把对面踩死”，你这不就是双标吗？另外，抄袭和侵权都是侵权，都该骂，0人在意李荣浩死活，李荣浩抄袭活该被骂，你可以和我一起说一句单依纯侵权活该被骂吗,1
私信被人骂的天昏地暗  还说什么lrh发微博搞人身攻击  “博取同情  黯然落泪”    纯妹妹粉丝在私信后台骂就是对的呗  骂ycl莎b  哎呀  哎哟  太有素质了  你是九年义务教育的漏网之鱼嘛兄弟 查看图片,1
那你还不是在网上bb吗，真是双标到了极点你也可以去法院呀,0
哪句话说的是syc粉丝？为什么不发出来开锤syc？就因为syc侵权啥都往syc头上扣？lrh说啥就是啥 我说你爹xd了 你爹是不是就真的xd了？,1
道歉就必须原谅？刚开始就是因为单依纯这个逼改的太难听所以不给，她们明知道没给授权强行演唱，还不让骂了？版权方就是不想让单依纯在演唱会唱难听版，所以不授权而已,0
lrh自己说的啊私信被syc粉丝骂的铺天盖地，这有啥洗的啊，承认粉圈氛围差很难吗，粉丝群粉丝骂ycl呢，ycl多少无辜莫名其妙完全疯狗，你总不能又说图是p的吧，那我还能说啥了 查看图片,1
他回应个几把，直接去告他不就完了，让他赔个倾家荡产,0
被恶心了就应该恶心回去，周知,1
而且我看李荣浩的公关一股子登味，他应该看不惯单依纯很久了借机发泄一下也没啥不好的网友别被他利用了,0
而且单依纯不是受到了她应得的惩罚了吗？她要赔钱也要被骂她自己承担了冲动行事的后果啊我是觉得网友没必要参与围剿，看两个艺人单独撕不就好了还有，别污名化圣母这个词,1
当你辛苦创作被人魔改，拒绝授权还明知故犯的时候，你能做到圣母的那天再说,0
别乱打粉籍，我纯路人，单依纯为人不行，李荣浩又是啥好鸟，以为互联网没有记忆吗，你杠我就是我对,0
歌手上把人家歌改成那个鬼样子人家一句话都没说，后面强行侵权，还要李荣浩当哑巴啥也看不见，你syc不懂尊重前辈，前辈为啥要尊重你啊,0
有些人也确实欠教育,1
喜欢女艺人飘点这是人话吗,0
我没觉得是rsgj而且lrh原字眼是从前几年在舞台上掉眼泪的女孩变成现在侵权的人，这是事实不是吗，她不可能不知道这是侵权，我也是纯路人啊,0
这就是你们粉丝洗白的话术吗有点低级 除了你们没人觉得李荣浩在人身攻击,1
你也够恶心,1
哟，做了见不得人的事还不让说，乐,0
确实，不过真的喜欢不起来她，人品太有问题了还背刺之前的前辈，听歌可以别粉人,0
按照现行法律的规定，你哪怕把别人的歌拿过来改几个字，都很难界定为抄袭，国内对于歌曲，小说，影视剧的抄袭鉴定和处罚几乎全靠行业自己纠正。所以以你的想法，国内是几乎不存在抄袭的。,0
所以老登聪明啊抄外国人，拿了10年的版权还还被告，此等名气确实只能夸老实人了,1
我想知道不去会怎么样,0
还依旧查主页，“依旧”从何而来，被人查过几次换到了这第几个批皮小号？,0
而且我跟你讲了，两个人都被骂了，我什么时候讲李荣浩无罪了？再说，他的评论区证据也摆得很明确了啊谁跟你讲他之前抄袭没挨骂的？这评论区不都在骂吗？别逗我笑了,1
和呆子是沟通不了的！,1
给自己取的主页简介还挺到位的啊疯??,0
之前抄袭挨骂了？好一个轻拿轻放，不是老登这次自己主动上了舆论风暴被架起来才回应的嘛？学了个强盗逻辑这四个字终于给你用上了啊？,1
送进去哈哈哈哈哈哈哈哈哈哈哈哈哈哈哈哈,0
笑吐了，送进去哈哈哈哈，先回去上学吧,0
没去法院已经是对他最大的同情了，音著协会员部侵权邮件都下来了，你跟我讲没走法律途径？他要真想起诉，随时都可以知道吗？他现在只是想把歌给下架了，再说单依纯作为一个总监制人一点版权意识都没有吗？你看他的回应，完完全全把锅甩给公司了，讲白了他离把单依纯送进去只差一步，知不知道？,0
到时候去了法院你又不乐意了,0
很多单依纯粉丝骂啊,0
那去法院呗，你评论什么,0
是这样的,0
还搁这儿公益演出呢？人家自己都承认了被背刺了吧,0
去法院去微博，这都是维权的途径之一，权益受到侵犯了，还得规定人家只能去法院？线上线下都可以啊这并不冲突，而且娱乐圈名誉就更重要，明星的作品有传播有引导风险，如果只是私下法院解决，那很多劣迹明星都不会被封杀，今天李荣浩侵权了，也支持他被反噬，就事论事，错了就承担后果。,0
在大街上有人偷你的钱包，不能追着骂不能追着打，你必须得私底下偷偷告诉小偷，让他还给你是吗,1
真是看不懂了，去法院然后公开发判决很难嘛？,0
被侵犯权益还不能说两句,0
对，社会对女的也应该这样,0
不然呢？对你好？被侵权了还不能说话了？,1
到底在叫什么？对版权意识弱到这个程度了？你侵权我的作品我直接开麦骂你又如何？人家做这么体面你到底在坐不住什么？,1
笑死 你可别打着女性主义的幌子给我们丢脸了好吧侵权就是侵权 错就是错了 辩驳啥呢,1
单依纯杀了人 你李荣浩就可以把单依纯杀了？杀一个杀人犯不犯法了 同样的道理 哪怕单依纯犯错了 你就可以犯错了 我们指责的是犯错的行为 李荣浩那个事情他自己已经承认了你们也没有一样喷 侵权就是侵权 没什么好说的 抄袭也一样,1
李荣浩杀了人 你单依纯就可以把李荣浩杀了？杀一个杀人犯不犯法了 同样的道理 哪怕李荣浩犯错了 你就可以犯错了 我们指责的是犯错的行为 李荣浩那个事情还不确定 被实锤了也一样喷 抄袭就是抄袭 没什么好说的 侵权也一样,1
双标狗,0
李荣浩是小眼睛的作曲?制作人?编曲，像尼玛个傻子一样，懂不懂作曲制作人编曲是干什么的,0
一个团队都不知道自己被拒绝了？那真的蠢如猪了,1
还问别人懂？，你自己懂个p啊,0
他是总监制。。像尼吗个傻子一样。。懂不懂总监制是干什么的？？,1
你就和这博主一样，喜欢打拳这就开始女歌手上了？,0
本来就是，她又不是靠给人写歌出来的的！李本来之前就是写歌的！后面才慢慢开始唱，再到后面上歌手火的！那英，蔡依林，张惠妹她们的歌你能说出几首她们自己写的！真的对年轻女歌手太mean了！这是恶心的饭圈,1
那为什么要唱，李荣浩逼她唱了？,0
小朋友多大年纪啊，连什么是犯法都不知道就上来替人出头了？你又知道批斗是什么意思吗？多读点书吧好吗？也就你这种文盲能被骗到以为是没有核对好了，真可怜。,1
就这脑子还续签小能手呢,0
歌手的版权是歌手的 演唱会是纯妹妹的盈利性演出，退一万步再说，版权是一次性的，唱一次付一次的，你不会不知道吧,0
李荣浩自己发文承认的呀，原来初二学生的发文连自己的粉丝都不愿意看，哈哈哈哈哈,0
版权问题是公司经手，但是你觉得公司在被对方公司以邮件形式明确拒绝授权之后会不告诉单依纯吗？单依纯作为公司的艺人，这种事肯定是要通知的，尤其是没通过他人授权的，除非公司想压单依纯了，还是说你觉得公司想得罪李荣浩然后甩锅给单依纯？而且单依纯还是总监制，她更不可能不知道这件事了,0
怎么抄了？ 你有证据吗,0
那还不是唱了是求着她唱的吗,0
这都能洗佩服,0
他自己都承认了你还洗呢?别人不小心侵权就要被骂，你们抄袭就是失误?,1
那干嘛不唱,0
666，自己身为总监制自己不知道版权问题处理好了没？？？你是不是不知道总监制是干嘛的,0
那倒是唱别的歌啊 有版权吗,0
对的，有的是歌等着她侵权，碰上软柿子就接着唱，维权了就出来道歉，甩锅给公司自己接着当总监制,0
那她为啥非要唱啊,0
那干嘛不让唱还要唱？,0
来了，就问一句单依纯侵权是不是客观事实？你拿出李荣浩抄袭的客观事实来再骂吧,0
我说东你说西,0
那倒是唱别的啊 侵权这也能洗吗,0
看看回应,0
总监制 单依纯,0
歌没唱非要唱人家的 而且说实话改遍的很难听！真的！难听！别人的作品改成这样还天天跳出来唱 人听到自己的作品成这样不气死才怪,0
小眼睛不是你写的为什么要顶着编曲制作人作曲人的名头十年之久，还在音著协登记为自己的作品？别拿误发甩锅给前公司，你可以是音乐才子?版权第一人?内娱最严厉的父亲，十年之中没时间抽出哪怕是一天改掉自己的署名？,0
那你别唱啊那你别唱啊那你别唱啊那你别唱啊那你别唱啊那你别唱啊那你别唱啊那你别唱啊那你别唱啊那你别唱啊那你别唱啊那你别唱啊那你别唱啊那你别唱啊那你别唱啊,0
