text,pseudo_label
算了吧你，中国女性在欧美、日韩甚至是非洲，是个什么名声你心里还没个数？互联网时代了，谁不上网啊，对着国内这群要价高昂还得好生伺候的**，不如对外另辟蹊径。真正的媚外是什么？对着中国男性要车、要房、要彩礼、要姓氏、要地位。对着外男就可以连着自己的姓一起改了。这就是媚外，怎么的？中国男性外娶改姓了？中国男性外娶是非洲、印度来者不拒了？人都是看性价比的，一个是理解男性压力，不要车房彩礼，可以一起奋斗的外女，唯一不好的地方就是文化差异。一个是侮辱男性，要车要房，对外可以不讲底线的国女，唯一算得上优势的地方就是讲中文。正常人做出的选择，应该都是让你们可有可无。,1
说白了非洲很多国家从部落酋邦被殖民者强行拉进工业社会。没经历过早期摇篮就想直接浩瀚星宇，很蓝的啦,0
别回复了，这绝对是个领工资的。,0
你不带上大家一起歧视，想吃独食？,1
那既然有这么多优秀人才，黑人为主的国家为什么没有一个强国？??,1
找黑妞可能真的是找不到其他吧,0
偷井盖这个词，最初是北京叫起来的，因为那时候在北京从事废品回收，处理，再生的大部分是河南人，还有大量河南人从事长途运输和物流的。这是有产业链的，你不是河南人偷了井盖很难处理掉。人口大省当时穷，偷井盖割电线时有发生，敢偷也敢收，片警顺着口音查，十有八九能破案，九十年代两千年初，这是经常有的事儿。后来是多管齐下，偷井盖绝迹了。在北京，好多河南老板靠着废品回收发家致富，一几年的时候，到北京郊区，城乡结合部，大的仓储，处理厂，回收场里面，河南老板的豪车随处可见，一年都是几百万的收入。那时候你百度地图下固始鹅块，胡辣汤这些典型河南菜，看下它们都在北京什么地方，就能知道当时的辉煌了。,1
在，钱最重要,0
不仅有，而且在大陆的黑人，很多都有中国女友,0
"应当这样夸它:人家超时空爱情,你是跨物种恋爱.??",0
我河南在东北上大学，还有新疆同学的，是不是没救了,0
你说这话脸不会红吗,0
公开数字大概20%以上，不过看最近非洲新冠检测情况，我已经不相信非洲的任何统计数字。,0
有一说一，生下外国孩子的女性绝大多数都不认为自己的孩子是中国人吧？尤其还是黑的。,1
这样的孩子搞不好户口没有……连学校都没法去呢,0
泰迪家族嘛i了i了,0
主要是杨笠这伙人搞性别对立，然后就是twitter上easy girl 等等，值得引起重视，黑人实在没法吐槽，广州地铁乌压压一片??????,1
"当面就是从贴吧开始黑河南的，我记得特清楚，什么老乡叫成""捞翔”",1
我在湖南黑车基本都被打烂了 初到黑龙江 ??一口南方口音被坑了不少钱 难怪叫黑龙江,1
再叠一个buff 读的山大,0
微博发声的最大声是女拳，讲道理女拳如果不是说那些骇人听闻的反人类的言论，而是正能量的讲这么改变，谁喷你可能还成为主流思想呢，毕竟在中国女性在言论上还是受保护的。打嘴炮那些不算呀，如果硬要算那么低端我也没话说。是女性自己不争取正确价值观，让女拳这样妖魔橫行，而女拳要的条件是政府和人类不可能接受的，也就是说不会改变什么，占着位置不做事。,1
相当稳 加个东北念过书 广东做过菜,0
自由归自由，永远都只能是有限度的。,0
哈哈，“南方商人”盗挖黑土结果是吉林人，这就没人说了，哦，吉林确实是黑龙江以北??南方人在公交车大喊东北垃圾被揍，结果是东北自己人，也没人提了??,1
恩我看了。这么说吧，我不反感他人txl，虽然不理解（心理上永远有层隔阂）但我选择尊重对错不是我或任何人来定义的。毕竟存在即合理，无论是txl还是对txl的抵触心理，我认为都是有原因的。你可以想想，有些事情是无法仅仅从道理上说服他人的，人的认识中不仅只有理性，感性往往占据更多的部分,0
抖音的肤色都美颜以后从黑色变成巧克力，所以要自动去掉美颜,0
你刚回答完，评论里这就有人给你打样儿，??这些人，也就这水平了，没招。不过你大可放心，能在知乎上搞地域歧视的人，现实生活里大概率也成不了啥事，折腾不出啥大浪，这种人也就上上班，打打游戏，拿着上限八千的工资搞搞歧视，搞完被房东催房租，对房东还满脸记恨??，这些人的地域歧视言论，你就当看个笑话就行，不用当真。,1
??这样的直男好少见额，羡慕了,0
所以如果一天醒来发现你以为的好的女性朋友在刚你，就不会厌恶了吗？,1
建议去看看去年9个用全国一卷省份（包括河南）的分数线。会颠覆你的认知,0
本东北人表示的确如此，河南黑吉山东毕竟被黑一个是穷一个是毕竟知名，江西这几年彩礼也风口，至于青海这种地方，你问他青海属于西藏还是新疆，很多人的确会谨慎地二选一的。,0
被歧视一般客观原因的。歧视一般发生在底层。中国美国印度都有一个很不好的文化现象，就是宣传为富不仁。但到了现实中，你会发现违法犯罪的绝大多数是穷人。换你有钱了，你不会彬彬有礼？社会上“为富不仁”的现象，大部分发生在穷人装富后欺负穷人，少部分发生在穷人黑恶发家后继续黑恶，欺压百姓。但是那些清白发家的富人，大部分极富同情心，并与人为善。不要以为清白的富人少，看看中国在世界上的优势产业，不是清白的富人，根本做不出来。河南人偷井盖，原因是什么？是穷啊。过去安徽人在长三角名声也不好，现在越来越好了，原因是什么？徽商的经济跟上来了。过去江西人在我家乡名声很差，因为来打工的，一旦没有收入，有很多偷盗。现在好转了，因为这种人少了，反而一些肯吃苦肯创业的江西人在我老家成了老板，比普通当地人还富有，所以当地舆论对江西人好转了。,1
不如，人家是生意，要收钱的，这个是免费。,0
你这放在春秋战国时期也算是混血了,0
有些国男多学着点吧??,0
上次给我舔的女孩说她男朋友就是这么干的，不会是你吧？,0
你有支持同性恋的权利，我有反对同性恋的权利，事实上同性恋并不会因为反对的声音消失，同样的反对的声音也不能消灭同性恋，其中任何一种声音想通过道德绑架的方法来使对方消失都是不现实的。,1
因为有曲阜，孔子，贴吧都骂了好多年了囧济宁州，太白楼，三岁的小孩c老头，这些都是说济宁人的,0
可别了，唱衰东北的急先锋就是黑龙江人。辽宁人在跟南大人据理力争，黑龙江转手就把公安局设海南了,0
mark了，有空看看,0
我们内地就先被他们黑得很惨啊,1
看来你没在内地找过工作,0
算了，女拳只有极端和温和,1
还是不一样的。首先，在非洲的中国人几乎都算当地土豪，土豪享有优先交配权很正常，国内土豪也没少玩。其次，那帮渣男不会因为有个非洲对象就有优越感，更不会因此贬低国内女人。相反，有国外对象的女人明里暗里秀优越，贬国男，甚至当二鬼子的可太多了。,1
河南比较特殊。河南有2300万人常年在省外漂泊，某些地方的人会认为这是一种“人口扩张、文化侵略”。你没见过真正的“排斥”，那是非常可怕的，搜一下“印尼事件图片”就知道了。印尼事件中，受害的都是广东同胞、福建同胞。另外，举个例子:江浙沪（吴语区）的吴语，迅速断代、灭绝，他们可能会认为这是外地人/内陆人太多而导致的。江浙沪的户籍人口严重老龄化，迅速被“中原各省”的人口替换掉。。。总之就是利益冲突,1
确实，都给你??兄弟盟向你学习,0
果然是陕狗啊,1
你在哪里实习,0
你当然可以讨厌，这是你的自由。我就是河南的。我从来不偷，不抢不骗。行得端，做得正。,0
这不是非洲boy吗，他的原视频特别有意思,0
确实……很有些不适，同样写过去社会的余华作品就蛮喜欢??,0
回老家要割礼??,0
五等女人嫁非洲，原來如此原來如此,1
如果你看一下民族主义的词条就知道民族主义不是贬义词。极端民族主义才是。民粹主义也和你理解的不一样,0
黑龙江人天天东北东北，都忘了自己叫黑龙江了吧。拉着辽吉和你一起背锅？,0
我结婚的时候去做了婚检的，你结婚的时候难道不用做？,0
赵丽蓉怎么了？赵丽蓉老师还是非常正气的。中央台一直被北京人和东北人霸占着来黑南方人，但赵丽蓉老师应该是不懂他们的话术。,0
在我们这个年代，南方比北方发达，你们北方人均GDP低，拿的出手的省不多，别被你家老人给骗了,0
你扪心自问，你会对你的女人一辈子负责任一辈子不变吗？假设她日日操劳逐渐老去，而你职场得意遇到一个更漂亮更如意的女子，你会不三心二意吗？看到一个数据很有意思，2015年，中国男性出轨率为34%，比2000年的11.8% 增加了188.9%。而2015年中国女性出轨率为13.4%，相比2000年的4.1% 增加了226.8%。即使整体上女性增幅要高，但男女出轨率的差距不但没缩小，还逐渐拉大了。中国女人变了吗？答案毋庸置疑。中国男人变了吗？答案更是斩钉截铁。也可以说，在出轨这方面，中国男人从未变过。,1
一个山东的哥们说了，山东最魔幻现实主义。他还说，中国基本上也是??,0
唉，不得不说彼此都任重道远啊,0
我今天恰好看到这条回答 放心 你绝对不是他说的那种要一棒子打死的人 你看他最后一句话就知道了,0
"南满:我们南方才不吃你们北方的粮食，我们吃的都是南方的粮食。北方人:断粮。南满:oh,no!米怎么这么少了，怎么买不来米了，面根本没有卖的。",0
呵呵，反正你们这些夸黑人的人，遇到的黑人不是家里是酋长就是家里有矿，好家伙，黑人人均瓦坎达王子是吧？,1
上海人黑安徽真的很厉害，上海吧贴吧里很多黑安徽人的帖子，另外江浙沪有些企业也不招安徽员工,1
很难不支持 确实 这个圈子的人 还总觉得自己高大上 笑死,0
这个事情上估计是大势所趋，国家宣传口的风向都是在推进和黑人同婚，想改变这个趋势，极其困难??,1
这就是没救了,0
上海是全国媒体有预谋的带节奏黑！本质上是打压上海地方势力！,1
原因很简单，请问女的是被黑人强奸的逼的吗？大部分并不是吧，似乎是她们自己的意愿吧,1
十几个那真的是百分百中枪了，概率太高了,0
打不到车也能黑？,1
说实话 你挺自卑的,0
一x一路?各种意思。,0
这个吧说真的不否认男的会有玩玩黑人里的美女的想法，但是应该没有几个会娶黑人女的??,1
恁néngshà咧？,0
河南户籍的新疆人，手动微笑，我要和他们这些地域撕逼到底。,1
少部分的同性恋不变态，大部分的比较变态??,1
你们江北不也说安徽，江西。只准你们讲别人，别人说你们就成地域黑,1
老大，别人国家引进移民，都必须过三五关卡，从语言能力到主义的认同。咋到了中国就啥门槛也不要了呢？ 你不可以让他们学儒家文化，学集体主义？明明可以的。二，中国人在非洲也生了很多蛋留下了。哪来的中国男人就很负责？呵呵。评论区一片“我们下的蛋多很自豪”。三，三非的矛盾怎么会是种族矛盾？明明是个违法问题，按法律处置。,1
我就是个，感情经常被骗。真心得不到好报，明明聊的很好，结果只是为了和我做爱,1
短视频不少公的黑人跟中国女孩交往的人啊爆出来的新闻也很多啊,0
拿那个破戒指骗女人。,1
逐字逐句看完，有一个观点我有一点反对意见，异性之间的行为符合人伦天道,0
推荐重庆孜孜不倦黑成都和网宣踩不停的宣传拉踩，特点就是，喜欢吹一个唱红脸一个唱黑脸，一个重庆的负责吹其它的就是哎呀不要这样我们重庆不是这样的全都在骂装出一副与世无争，结果一看拉踩言论点赞全是它们隐去点的。耿直就是它们的遮羞布,1
是啊，只要不打扰到正常的生活就可以了,0
自由平等是个伪命题，女性以此为驱动力，为了掩盖无意识的慕强，懒惰，自负等目的，实际上是以利益驱动而不是自由平等。,1
你是只字不提东北人多会骂人多会地域黑,1
我见过无数的江苏人默认自己是日本的，不搞个夏日祭浑身不舒服??,0
其实互相尊重就好了，我们允许你们同性恋的存在，但也允许我们有些异性恋接受不了！这是生理上抗拒的！,0
没有，1个去了日本，住在大阪。还有一个孩子入中国国籍，现在已经上大学了，人家是华东师范大学心理系高材生,0
默??学到了，好字,0
??还有人认黑的，你知道猴子说那些的么？,1
什么叫新疆人？维吾尔族？,0
卖钩子的弄啥咧~,1
天津人心碎……就说没钱就是原罪呗,1
好吧，我是南方的，没觉得这有啥封建的，包括之前看过他们说的山东的礼仪，我觉得这不过是民俗而已，不至于上升到封建这么难听的话……,0
河南老乡前来报道,0
??陕西人心里河南是全国人民都黑的对象，实际上不是的，陕西人往外走的很少尤其像广东福建这些东南方向，实际上被工厂老板排斥的更多是贵州四川那边的，而不是河南,1
我听到的版本是过去西藏人一生洗三次澡。出生，结婚和死亡。这个是最靠谱的。因为西藏的很多错(湖)在西藏人眼里是神圣的，根本不能捕鱼下水之类的，而西藏那种环境，洗澡很奢侈，根本没条件。,0
可以说我有偏见吧，但我心里实话就是，只要和老外有过交往的，我都从心里嫌弃????因为目前能看到的的情况就是，绝大部分都是倒贴??真爱也许有，但少之又少。,1
女拳直接把女权开除出女权??,1
我不觉得是困扰，我觉得没啥问题，那些作品我只想远离??,0
对真的碰到这种气死了，有些人来上海要来的，来了上海之后骂上海人配不上这个全中国的上海，打压上海文化（比如方言），还因为“上海是全中国的上海”来说本土文化被打压是应该的。我吐了。,1
山东的就不要来凑热闹了,0
??见义勇为：南京小张。??嫌疑人：黑龙江张某。（在南京居然还敢见义勇为也是很勇了）,0
东北其他地方没去过，哈尔滨待过2星期，觉得那儿的人真的很热心很热心，印象最深是带孩子刚去哈尔滨的肯德基，孩子不舒服吐到地上，我当时特不好意思准备用纸巾清理，服务员很热心上前说赶紧照顾孩子她来弄，完了还给孩子了一杯热水。第二个就是娃生病买药，哈尔滨药店大姐看到孩子生病那个心疼啊??,0
怎么讲起日语了,0
你就是最大的地域黑，先黑河南，骂河南，让河南人骂你，你再把河南人骂你的聊天记录截下来，再去挑动东北人来骂河南人，从而成功拱火,1
对……我也是无论如何接受不了，所以我也会批判，没有为什么，就是接受不了想要批判而已！,0
并且照你这样说，剩下的女人全都是不爱国的，那你为何不说剩下的男人呢？知乎唯一让人讨厌的大概就是男权主义太重吧！,1
我支持你去非洲，去美国。就是别再中国，中国配不上你，仙女的气质。让我们在这个国度里静静的羡慕你。快走吧。别回头别后悔。后悔也别逼逼。中国还是纯黄种人为好,0
愿意啊，至少得给孩子一个完整的家,0
怕啥啊，结婚前调查好，约炮的，嫖娼的，经常去夜店KTV的，有过三个以上前女友的，这几条只要占上一条我都不嫁??,1
鸡就算了 带个娃的还可以接受,0
宁夏呢？知乎上我还没见过宁夏发言,0
是都有很多中国女友????,0
因为太多人的否定了，所以我还是害怕,0
我二姑好像就是大石桥的,0
这位小姐姐评价相当精准，把整个事的来龙去脉，包括人们的心里所遇到的问题，已经提的说的明明白白清清楚楚，不错，很有眼光，但愿女孩子们都看到，尤其是我们的女大学生们，别再为了几句甜言蜜语，为了所谓的几分面子就找不着北了,0
你确定？两三个月前刚落地珠海不到一周，在前山，那雨感觉还没多大呢，把我朋友的车都淹了，没过车窗叫水浸街？,0
对，也别舔个??脸说，你既然爱我就别在乎我的过去这种道德绑架,1
不值得批判。,0
不是已经入狱了吗，话说回来，我心中反黑领导人是快手发展黑人祝福起家，领导一群肌肉黑人喃小弟的壮硕中国男人。当地黑社会一霸，并且每个黑人工资一个月只有一千块人民币。真正实现了心理生理双重奴役黑人喃。,1
表示当地汉族人中河南人还是有的啊，甘肃，四川，河南，浙江（大规模，因为甚至有多个商会）这种估计是听闻什么谣言或者被人骗了，要不然不该这样的·······,0
有，你不知道而已。美国前几年的数据是四百万同妻，有大量的影视作品在描述这个群体，还有一些同妻互助小组的网站。滥交，骗子宫，恶意传播hiv，人品差的人无论什么取向都是自私的，也有少部分坚守立场不骗婚的人，那些才是我们真正要去尊重的对象。,1
有啥承受不住的??不要把网络上的东西当成“人”他们只是一个又一个负面情绪的具体化，如果你把他们当成人那肯定承受不住，唐山哪怕真杀人又和他们有何关系？不过是借此发泄阴暗面罢了，正好可以把网络当做博物馆，俯瞰一个又一个垃圾灵魂??,1
是啊 跟你们就不是一类人??,0
张只对共产党有恩，对中国人民是民族罪人。??不服，自己去查江桥抗战，张是扮演的什么角色。评判历史从来就没有什么功过相抵这种可笑的话,0
相比黑人，你说的这个，我觉得可以忽略不计,0
广东那地方是人待的地方？待时间长人还不熟了？,0
想下一杯水滴上滴墨水，还它嘛好看，还它嘛不黑，黑人总是美化自我，抬高自身，只懂得向欧美索取对于先辈的赔偿，却永不感恩如果不是欧美亚人类，非洲还是石器时代！,1
别代表我。不管是现实还是网络上，见到你这样的肯定敬而远之。如果你想代表某个地区，先问问人家愿意不？他们全都愿意的话，那我见了你们那地儿人都避而远之。,0
境外势力再加上无知人群，太恶心了，全国制造对立，我不是河南东北这些的，但是每次看到还是很气愤，自己都活在最底层，何必这样莫须有滴黑别人呢，多去花时间赚点钱不好吗,1
然后。。。当下身在东北。。。,0
??我也发现广东??最爱地域黑。我现在看见广东ip就提醒他们该吃??了??,1
这个人说才只有四分之一我回他啊,0
你最棒???? 你去支持你的 我反对我的,0
害，事实就要正视。中国女权还在2017年被中国妇联判定为分裂势力呢。你们该打的拳还是照打不误啊。??,1
你TM在外面和自己家人不顺口冒出句家乡话，标签太多了,0
捐个市长过去吧,0
是的，通常只求这样的男女跟黑人出国，不乱生垃圾丢在国内污染环境，其他一点不在乎，毕竟是自然选择，智力水平也般配,1
爱信不信，链接没有,0
是的，生下来的孩子可千万别入中国国籍哦~~,0
拉出去，厚葬，别忘记给个狗头,1
首先华人劳工是由于一战大量法国青壮年男人战死，其次女孩嫁都没意见，去非洲就好了，最后还不是要留在国内找人接盘。那些微博也很坏，就和花了电影钱看了场坏电影一样，不能就我一个当傻子，所以我给它满分好评去骗更多傻子。,1
没有就对了，你们本来就是百越汉化。,0
那正常人因为别人恶意隐瞒病史被传染了，报复社会，又当如何？有不少人就是被别人恶意传染转身开始报复社会恶意传染更多人,1
都他妈是一个中国人，黑哪里都是黑自己,1
你居然能上知乎！,0
猪肉真香??????润回阿拉伯野father去??????,0
不好意思，55个，请把正黄旗带人踢出去??,0
接盘二字就涉及性别歧视了，不要这么说好不好,1
支持答主，再瞎的人看评论区各地的表演应该也看得懂谁是弱势谁被黑了,0
看来某些家伙忘了他们当年骂江浙人（此处的江浙指的是苏南浙江上海）是猴子的时候了，黑江浙人小气，黑江浙人娘娘腔，黑江浙人窝囊，都不叫地域黑，毕竟当年没有地域黑这个名词哦，不去想想当年春晚上那些个小品，都是怎么黑上海的，现在换成他们被人黑了，就接受不了了，还搞出了个地域黑的名词出来，声称自己才是被地域黑的第一批受害者，他们骂江浙都是因为江浙先黑的他们的，我是服咯，啧啧啧。,1
你几把谁啊，代表全国？,0
那你应该下去找唐山人赵丽蓉。,0
一样的，也会,0
过度贫穷和富有，都是原罪,1
你再说一遍？江浙沪被黑？,1
狗带风向是一回事，女性群体中一部分跟狗走那是另一回事??你觉得呢,1
法国觉得你说的很赞??，还有中国那些没有爹的小黑也觉得??,0
头像也很亮眼呢。,0
那叫一个地道！那叫一个美！那叫一个歹！百金?Show world new ??????,0
??来啦，吃香蕉，小矮子,0
早就已经解密了，光头没有让他不抵抗我这有一说一，不是给他洗,0
往哪里跑都无所谓，要清楚为什么往外跑，谁把自己害成这样的都不知道，看黑龙江跟南方人哭诉的样子真可笑,0
东北不是不抵抗，是如果抵抗，日本是小，虎视眈眈的关里及南方军阀才更可怕。中国被小日本侵略输在了内斗不团结，可惜快100年过去了，国人还在内斗的路上乐此不疲,0
当然是特例，一般偷偷摸摸最多自己组小圈子玩，大部分普通女孩生怕被误会都不敢跟这些以前的小姐妹来往。。。敢跟嘿贵一起的肯定都是为爱不顾一切的，这个跟学历无关。反而家庭条件差的会更多看中物质，流水线女工不会欣赏他的甜言蜜语，她们对能不能开车接送会更有兴趣。就是少才稀奇，竟然有为抢嘿贵在学校门口打起来的。,0
对于你这种人，举报就完事了，别跟我说话了。,0
找个大城市名字一换都差不多,0
笑 die,0
可能是仇富心理在作怪吧,0
和黑种人结婚就是把后代变黑，黄种人白种人和黑种人结婚生下来的都是黑种人，黑种人的基因顽强是有目共睹的，多和黑种人结婚，几百年后整个地球都是黑色的，在法国黑人的数量已经占据总人数的百分之八，我就不信当国家都开始变色的时候，那些极端种族主义分子还会手下留情，白人可不是善茬,0
真的不在乎干嘛不敢说，勇敢说出来呀，这么光荣的事，别瞒着呀。??,0
最后一个，馋到我了,0
是是我表达的不准确还是你读不懂？,0
对不起，我真的笑了??,0
就是啊，还有带着房子车子，绿了老公，扔了孩子的“高尚”倒贴，不知道是本质蠢坏还是灌多了“迷魂汤”。最恶心的还要“道德绑架”老实奋斗的苦逼中国男人。,1
直接说武汉吧。,0
说得不错真的害怕，显性基因洗不掉的等我们黑混成规模了整个国家会不可避免黑化下去，造成很严重的社会问题，想想子孙后代都被染黑的时候，这片土地还是炎黄子孙吗,1
啊！！同东北人！！回族后裔！！！,0
快进到学韩国男人摆烂,1
所以这个和狭隘没关系，就是看前任是个什么样的人，黑人的话九成九有问题，基本都有狐臭，得饥渴成啥样才找这个（没味儿学习好的比较少），得形成舆论共识，防止那些为了人口数据好看想引入黑人的XX专家的提案通过，过几年再讨论种族歧视对不对的问题,1
你的人生只有这些可以选了吗？,0
交往过的，不管睡没睡过我都不会要，当普通朋友都不可能。,0
南方不被北方黑？你这句就挺地域黑的??,1
我没说跟黑人女性结婚的中国男性也应该去非洲吗？还是你觉得跟黑人女性结婚的中国男性已经在非洲了不行。得让他们回中国一趟再回去？??,1
我在宁波做外审，前面年末又一次去公司，一个子公司的财务向我们骂了五分钟的贵州人,0
现在的高中生都知道那些跟黑人的女人不能找好不好,1
人家没惹你吧,0
我也来了！姐妹你关私信了，我的回复发不过去。你把我拉进去吧,0
老家浙江的我哪敢说 说了就是明明是我们歧视外地人??,1
啊哈，没了解过什么原视频什么出处，图好笑就够了,0
