text,pseudo_label
别提了，我说我觉得江北还有南京挺不错的已经被开除苏南籍了，甚至还有的人说我是反串的??其实我身边老一辈确实有点歧视但年轻一代基本没有歧视了，我不知道在网上为什么这么多内斗的人??,1
且不说台资“声名远扬”，你把我台湾岛仅次于半导体的第二大无烟工业放在哪里？,0
省会南京哈哈,0
每个人都有自己的思想的自由，你有支持的权利我就有反对的权利,0
我没这么认为。不过黑人想尽一切办法来中国蹭我们的福利，赖着不走倒是真的。,1
可以干货分享,0
你说狭隘就是狭隘了？你有你喜欢的权利你有你赞美的权利，我也有我不喜欢我也有我冷漠的权利。切莫给他人的行为定性来抬高自己，好吧？,1
蜀犬吠日 吴牛喘月??,0
我只歧视那些歧视别人的人??,1
汶川地震一样被黑也是一样的话甚至更甚，地域黑这种东西一代一代的,1
哈哈哈，上海被黑了开始反对地狱嗨了是吧？可是之前那些地方基本都被上海壬嗨过啊??,1
不是男人的，那是谁的？,1
可以不接受 但是不可以骂人 尊重别人是在庄严自己,1
比你如意就行啦,0
在古代男性向外族播种是征服者的体现。女性被播种怀上外族子嗣是种族被其他种族征服的体现，区别还是很大的。,0
老阿三了??,0
个性签名亮了:向韩国人学习??,0
表明态度即可。有时候对有些人需要以牙还牙。因为走的人不听道理，有的人顽固。对此，只能以牙还牙。这其实已经算是无奈了吧？总不可能寄希望于有偏见的人突然灵光乍现？我的人生经历也告诉我，你的妥协也好，讲道理也好等等，对有些人来说毫无用处，不如以牙还牙,0
反向操作去喜欢中国的地方留学不就行了,0
我不想嘿河南，我确实在河南人身上吃过亏??,1
我能说我最喜欢的NBA球员是个白人小角色么??真不是人人都喜欢黑人球星，更不存在崇拜，只是觉得他们球打的好,0
哈哈哈 你是揣着明白装糊涂吗 有不少媚黑女嘲笑国男几把小呢,0
我认同你的观点，就我而言来说，我是无法接受同性恋的，当然，我家人更不可能会支持,0
起码一首古风歌曲跟同性恋关系也扯不上，你可以支持同性恋，但请别传播，因为大部分人还是异性恋??，谢谢,0
但上海男人是真的小气,1
你们同性恋为什么不收敛一点，我们看着觉得恶心,1
呃……上海经济好吧，还不是照样黑,0
还有好多是玩的。把人弄怀孕了，提上裤子就跑路。这种就叫“华垃圾”,1
??连狐臭都可以被认为是男人的表现，中国男人偶尔没机会洗澡也能被拿出来大书特书??,1
大师，我悟了,0
因为你关注广东所以推送给你的都是广东，我关注东北推送我的全是黑东北的，那天我心思搜搜河南啥样，然后又天天推送黑河南的??,1
蛀虫？都是好好生活、工作、交税的。怎么就蛀虫？,1
最后一句绝了??,0
对不起了 我也是同性恋 但是我不会这样做 这种同性恋你要警告他 我也会努力变得不是同性恋 没人想当同性恋的 只有我们同性恋慢慢改变改正！,0
浙江人挺好的啊，为啥要被黑，浙江也是很富裕的鱼米之乡,0
反正我遇见的河南人都还不错,0
偶然看到，就评论一下。都是人类，性取向就是萝卜白菜，各有所爱，没有什么高低贵贱。只是想到男男，生理上超级排斥，也就是感觉恶心,1
奏你是天津的啊？还我们滦河水！??,0
抖音评论里说话最脏的地区，随便找个视频，一看便知。,0
存在也不代表就是正确的，要不然哪来那么多犯罪。。。,0
啊这……这是男生眼里的中国女生??，我身边的姐妹，几乎没有几个喜欢外国的人，包括外国明星啊之类的，大部分喜欢的就是又高又帅的，还有内种有大肌肉，男性荷尔蒙爆表的男孩子，而且认真吗？黑人来中国就备受喜欢，这是那个城市的黑人，我们这里有个小餐馆倒是有个外国人打工。,0
咦，河南老乡~,0
那你搜啊，关键字打上，不知道作者删了没。,0
“地球是圆的”是一句正确的话，而“同性恋”只是一个中性词而已，真不知道怎么可以类比的,0
现实没人打吗？搞出多少大新闻了。,0
比我说的到位,0
成都黑帽门确实大开眼界??那黑人甚至用女方结婚照作黄网头像，各种羞辱。就是不知道那女的后续咋样了,1
是的，现实里，男生遇到渣男排挤有限，女生是真的排挤渣女。网络上，男人对渣男渣女都骂，部分女性为渣女洗涤。很多男性眼里的女性就是那些女拳。,1
说白了不就是悖德感??逆反心理你还是青春期小孩嘛??上次在某贴吧看到有老哥教学：不要想着yue，而是去交女朋友，上完就冷处理，拿现实条件分掉??现在明白了家人们，原来pua约p技术都是跟黑淫学的，仿生学了属于是??,1
最后受伤的还是老实人,0
说能接受的，在过年的时候，把你的那个Ta大胆在亲朋好友面前说自己是同性恋，看看你爸妈会不会丢人丢到家？,0
和平年代，和谐第一,0
为了生混血孩子是咋想的??,0
不止是黑人，白人也不行。,0
西安本地作风彪悍的大多是东边某省逃荒过来的后裔,0
怪不得女的一嫁给外国人，屁股都变成那个国家的了，原来是因为跟这边断了，接受的信息都是另一方了。,1
黑人会吹牛，个个黑人都是牛津大学的博士，黑人他爸爸是剑桥大学的博士。有妹子就是因为这个被骗了。,1
就算实在改不了，你这种同我们也不会觉得讨厌和歧视的。因为你值得别人的尊重，加油??,0
外地，但是她跟她有利益相关………,0
美国人牛啊 能打 你们吴越人能打吗？要是古代就是吴越统一天下那现在肯定都在学吴语,0
现代女生都接受教育了 你这思想留在三从四德时期吧,0
祖籍河南户籍上海东北上大学??我的buff拉满了吧,0
这些话北方人说的不少吧，我记得几年前知乎上讨论南北哪个冷，很多北方人说自己去南方就受不了，没暖气特别冷。至于说南方更热的，这个毫无争议啊,0
炎黄领地早晚都会轮流被黑，中原，河北，东北，山东，陕西。。。未来一个个轮流黑，因为媒体掌握在国家手里。,0
如果答主以后有儿女了，如果他们是，你会慢慢地去理解他们吗？你会试着去找这方面的资料吗？,0
可是他们一样也是反华的，既然是反华的，他们的做法我们就必须抵制明白吗？,1
地域歧视源自人类需要简单的了解一个地方。你这个地方很好不是很值得宣传的，因为正常人都不会很差。但是一个地方的缺点是需要了解的。因为需要避坑，因为每个人的精力有限，不是每个地方都能在短时间了解到底是怎么样的。,1
没有问题 我觉得这样非常合适,0
黄种人不care，而且，既然性取向为天生的，为什么要那么在意别人怎么看？这个社会已经很包容了，网文网剧不少了，难道只有把这个东西变成主流文化才能算尊重吗,0
可能会更多，那个统计没有考虑到不同人群。实际上大学生感染艾滋病的几率是不断升高的。更何况很多艾滋病携带者自己都不知道,1
米西米西是日语,0
我希望直接嫁过去，,0
提高人口素质，百年国策。,0
东北人都是没文化的吗，哈工大，东北大学，大连理工都是什么……不会还有人认为东北人都是赵本山徒弟那个样的吧，那就真是缺心眼了,1
没错，让很多不懂事的年轻人觉得这种与众不同是时尚,0
我是说这个人的性别和这个人的性取向的基因是矛盾的，和性取向基因是否在性染色体无关。而且携带同性恋基因的人按理说应该没有后代了，但是自古以来就存在，说明还有很多潜在被掰弯的人。如果有掰不弯的人，那么我就希望社会支持同性恋，把潜在同性恋掰出来，这样很多年后就没有同性恋了。,0
??我在河南手机被偷了，然后报警，找出来那个人是新疆的，但不会觉得新疆全是小偷。,1
天生万物以养人，人无一德以报天??,0
人家不告诉你，你又怎么知道呢,0
指正一下，是奥地利落榜美术生,0
为啥济宁会被黑,0
女拳冲你可能只因为你是男的，同为穆斯林咱们什么时候能吉哈德了他们,0
行行行，中国男人媚外世界第一，国女世界第一优秀。反正被权威组织点名媚外的，国女那可是头一份啊。你们继续打拳，我们继续“媚外”谁也别耽误谁。??,1
我一东北人在江西上学发现自己和当地人比嗓门算小的了,0
气大，可能是狐臭，看清楚??,0
还有好多东北人说《南方周末》是江浙的。东方卫视是广州的。实在是无力解释。[摊手],0
地域黑就是明明视频里的人的口音就不是河南的，新闻标题非要扣到河南头上??见过太多次了,1
中国男人死光了????,1
复制转发一位老哥的，手脚骨折无法反抗，她呼救无人应答，脸上几十刀，她疼的快晕了，又被下一刀的疼痛刺激醒来，她感受着自己的皮肤被切开，深的地方已经切通脸颊，她用尽全力带动已经骨折的手脚挣扎，它用力按住她，把刀深深的切入脖颈 ！ …弥留之际 她想不通自己做错了什么，她想起了爸妈（我与她素未相识但是我能感受到她当时的绝望，写这段话的时候眼睛进了砖头） 她本来可以毕业，这里可能是她梦开始的地方，不成想，却是她所有的一切结束，她是谁的女儿，谁的姐姐，又或是谁的妹妹？我并不知道，但是她是我的同胞，5000年前我们血脉相通，我有义务为她发声。麻烦各位，让凶手能得到法律制裁，让以后再也没有这样的惨案！今日不为他人鸣不平，来日何人为我诉不公,0
抠脚大汉搞反串??,0
陕西人都这样的吗??,0
好恶心。。看的我胃疼。而且重点是，这什么黑帽门居然是2020年发生的事情？！都2020年了啊！！！??,1
虽然但是，到江浙沪做人力资源的河南包头，是真的十有九骗…我们那做农产招人的，遇见河南包头都得留心眼，信用奇低不按合同办事，契约精神几乎为零????算是给河南招黑的老源泉了…请河南同胞们明察下，绝绝子。,1
学习不好怕什么，可以发挥兽性优势去踢足球打篮球啊。,0
我怎么看是你们在歧视上海吧…,1
你搁发廊作市场调研是吧，剩下的一个是不是扫黄的警察？说实话是不是集体蹲墙角刚被放出来？,1
人各有志，各有所好，为啥要批判？搞不懂,0
请你去掉我们河南，改成我们东北下面的河南,0
三观好正，佩服佩服！！！！,0
与那些又有什么关系，毕竟性质不同，我们只是互相喜欢，恰好爱上了一个同性的人，我们也很惊讶??，不是所有同性恋的感情都是那样的,0
绝对不接受这种女性,1
不不不 我们云南人可比黑种好看多了??,0
哈哈哈，评论太搞笑了，实锤证明上海被地域黑最严重。,1
即使我是同性恋 我找男朋友 我也希望对方是刚好的 也许不要太完美 但是就是是我喜欢的那种类型 我如果是女生也是那种精英追求 所以我就一直单身,0
是你上来先讲一句骄傲的先富人，请问你从我的文章中怎么看出我骄傲?,0
是这样，有一次我们朋友聚会，去的那个女的请了个黑人来，我们都不高兴，下次不愿意和她一起聚。我们私下也认为这女的脑子有问题。那个黑人不过是那女的普通朋友。如果他们的关系是男女友，我们还真会避开。她后来嫁给美国白人，也是离开中国了。,1
纯粹喜欢亮晶晶的东西吧，跟某些鸟儿一样??,0
强迫别人尊重也是不尊重别人,0
关键是那么丑那么穷的h人，某些人还跪舔倒贴，这就是人的问题了，我们男的又不是sb！,1
说实话我最近对陕西的印象急速滑坡??我还是陕西某“兄弟省份”的人呢,0
河南被黑的最惨虽然一直有人说鲁豫皖鄂豫皖，河南被全国各种黑，说起河南就是总部偷井盖逃难，以前那个省人没有逃难去,1
和国女半斤八两，我为啥不找一个媚自己的烂裤头？,1
自己女儿如果交往黑人，那就要反思是不是自己没教好了???,1
五角场附近的女大学生，基本985了吧？一群女人和黑人留学生玩转盘，比起海天盛宴还刺激，这可是985的女大学生啊，可以英语交流的，我知道你不信，可现实就是如此。??,0
回老家要和老公十几个老婆相处??,0
同性恋是真爱，异性恋为了繁衍这种话是招黑的话。我年少的时候也整天说这些话，只能当小孩子说屁话不能当真。一个成熟的成年人都不会这么说。所有爱情都是值得被尊重的。,0
没事儿少说话，咱就当看不着,0
因为很多人得艾滋，他们又喜欢滥交，然后官方又要保护艾滋病人隐私。黑人跑了国人接盘，中间又会有分手离婚再婚约炮什么的，会传染给很多人。也就是说这些人如果留在国内大概率会传染很多很多人，所以大家不愿意让这些人留下来，宁愿一杆子打死一船人，可能过个几十年我们的后代艾滋病就会像感冒一样流行。??,1
这些渣滓确实到哪里都是渣滓。法不容情，绝不姑息。??,1
现在不都是这样么 原来只有我一个？我老婆是根本没要彩礼 换成宁德时代股票 那时60,0
国外不知道，国内搞服务的还是??♀比较多,0
你评论区不就有一个吗，经典装理客中装不下去了就开始破口大骂了，或许这就是当代小仙女吧??,0
说重点，艾滋病，要你命,1
你圈子太高了,0
现在辩证的来看小胡子错就错在输了战争,0
我在湖南旅游玩的很开心，好山好水好风景，历史文化积淀深厚，除了美食太辣都挺好的，本东北老爷们被辣的不要不要的,0
最讨厌没了解，动不动就极端女拳、极端男权的，麻烦你对比下整个网络的声音里面，谁的极端，谁是起始者，谁是反对者。谁是进攻，谁是防御。,1
看你是女的好欺负罢了。,1
确实在骗你，在美利坚亚裔男的地位最低，内个在那里比亚裔男男对异性的吸引力都要高不少。当然意识形态在他们那里确实影响不小,1
我靠真能下得去手啊，我去主校区的时候也见过几个又黑又肥又丑看不清脸，可能是我的学校太好了女生都挺保守的，没听说也没看见哪个女生和黑人谈恋爱??,1
真没有，越丑越直????,1
他说自己是湖北襄阳人,0
同性恋先天的？？,0
这是需要进化，得成千上万年呢。,0
怕不是不知道广州一堆汉族小黑人吧??,0
黑人都是默默默默默默默默默默默默默默默??,0
有些女的就喜欢玩新鲜感，认为外国男比郭楠好，墨人有劲还带艾滋，没办法部分女人喜欢????,1
个人觉得吧，挑头的有错，但是跟后头闹事儿的就无辜？,1
不存在地域歧视，只有穷人歧视。,1
我在苏州待过几年，“江南三村”不是自嘲吗？并没有外地人用这个来歧视当地。上海人对外地人的歧视是客观存在的，这个洗不了，但上海人并不是很歧视北方，他们只是歧视外地。,1
骗婚啊。。。,1
你来杭州一趟，就知道有没有歧视安徽人的了。我作为一个杭州人都得承认这是事实存在的，当然这都是以前的事了。,1
黑南方临海地区长相的都是低端下人，就你长的像欧美人？,1
恰恰这两个问题无法解决，要解决必须要主体种族让利，并且黑人自身在政经教科军文等重要领域内有所建树。但很遗憾，这两点大多数都没办法做到。 白人老爷们不愿意分蛋糕，你还想硬抢不成，黑人再能闹，即使出了总统，那也改变不了整个族群的地位，因为那只是黑化白心的总统罢了。,1
笑死了，eg的名头是老外安上去，关中国人什么事,0
江南男人尖酸刻薄的样子一眼就能看出来，有人回一句就拉黑跑路，哈哈哈,1
我不接受 而已 我凭啥要消灭人家？？,1
歧视了又咋滴？甚至希望他们能被德国落榜美术生同等手段对待,1
常州有资格说我南通吗??,0
讨厌洋垃圾，可是作者情况里的女孩确实可叹可怜，你这直接上升到基因、父母、祖宗，你太极端了。,1
说的也对??,0
艾滋病 除了母胎里带的 剩下的都不值得同情,1
要是我周围朋友出现个和默交往的直接拉黑不用再见了??毕竟我怕哪天把我也拉下水,0
充满了抠脚汉油腻荷尔蒙气息的匿名小仙女????,0
行吧，可能我比较敏感??,0
有一部分南方人是不是分不清北方口音啊 上次我在东莞看见两个人吵架 一个广东本地的 另一个明显是唐山口音 旁边就有人说:哪里的？听口音东北的吧??,1
要是哪个国女能把黑人老公真给弄成结婚登记的合法老公，还能一直呆在身边一起组织家庭，抚养后代，我还真高看那个国女一眼。。大部分媚黑女，说到底就是个几把袋子，你留得住人嘛你。??,1
别人下班了哪里溜你不会都监视吧？生出来的那些是铁证了吧？不出去搞黑妞也不等于戒色吧？网传的东莞下岗女工非洲工地重新上岗，这个如果是真的也挺合情合理的吧？,1
？你怼人怼错地方了吧，我没提东北吧，我也没说什么粮食啊，你在干嘛啊，,0
这。。。。其实最歧视安徽省的，一个是江苏，一个是上海。我扬州的，靠安徽，扬州市各个房地产商都说西边那里房子差、不能买，安徽人多，素质差……平时听到安徽就说人家侉子，高考结束报志愿我们班好几个人坚决不报安徽的大学，问他们为啥，他们就一脸鄙夷…………,1
论惨天津还轮不上号，比如都喊上海租界，你看见几个喊天津租界的，天津租界面积比上海还大呢??,0
是弯弯还是小崽子，如实交代得了,0
我还蛮想去新疆，怎么会有说这么重的话，简直无可理喻。。,0
美国亏欠黑人，他们在美国要补偿理所应当，可中国不欠他们，中国又没有搞过黑奴贸易??又没有压迫过黑人，凭什么来中国耍横,1
反思一下，答主为什么不回你,0
准备折跃？,0
感觉这种女人生出的小孩都脏掉了,1
反串一律水葬,0
不吃辣而骂人家吃辣虽然稍显粗鲁但也无所谓。 —— 我觉得这句话有问题，自己吃不吃辣，喜欢或者讨厌吃辣都是自己主观上的事情，没有任何问题，但是因此上升到骂人家吃辣就有问题了（这是有所谓的）。就像同性恋恋爱没有问题，但是因此骂异性恋就是有问题了。反过来讨厌同性恋也没有任何问题，但是上升到侮辱攻击那么就是有问题了。这是个度的问题。。。任何的喜好行为都以不伤害别人为前提。,1
并不会，现在偏远地方就行买卖埃塞俄比亚新娘??,0
愿闻其详。求数据,0
那我就实话实说了吧。??从我们童年时代开始，安徽那边过来的就是乞丐，捡破烂，穷苦农民工，你说让我们没点看法那道德要求也太高了??根本没有黑过。要想改观，等历史翻篇吧。,1
你哪来的结论，我实际考察了四川各大高校根本不是。,0
雄性基因是排外，雌性基因是择优，如果思想上升就不必去骂黑人，但在这个世界大染缸里，清醒的人毕竟是少数，大部分人靠本能去抉择，即使我明白我也一定排黑的，同族群能容我，而异族必不容我,1
人家一句，爱情里就是能分出个高低，就是没有标准，选黑人都不选你，说明你比黑人还差??直接给你整破防??,1
安徽被黑麻木了，为黑而黑，低调成这样了还要黑,1
是不是汉族又怎么了，56个民族一家亲,0
我觉得答主没必要黑皮黑皮的叫他们，咱们国人在非洲也没少玩黑女，这些中国女孩找黑人都是自愿的。这些女孩追求爱情也好追求感官刺激也罢，客观上都安慰了黑人，黑人受到慰籍就不会伤害其他女孩。对这些女孩应该宣传的是如何防护艾滋病，高校艾滋病增长过猛有黑人的功劳。潜伏期6-8年，病毒携带者根本查不出来，所以有些有过黑人男友的中国女性传染给了中国丈夫和他们的孩子。所以个人认为女孩找不找黑人不值得讨论，艾滋病防护才是该让其知晓的。,0
北京??不是地域黑？,1
你好，我也是个男生，我有个同学嘛，他高二到我们班的，他以前这个人挺不错的，也比较有个性，也给我说喜欢女生，而且不会有过于亲密的言行举止，但上了大学，因为他分数和我一样，我和他关系好，所以去了同一个学校不同专业，大一上期还好，作为朋友我也没我脱单，一起放假回家看电影啥的，这下学期我发现他就开始变了，和我说话很亲密，而且我感受到有点什么东西，他是不是对我有感觉啊（作者能给点经验吗，我不是很喜欢这种东西，没恶意哈）,0
我去，我无法用语言评价了都,0
毕竟江浙这几年发展太猛了。以前除了上海偶尔被北方人调侃，江苏浙江好像存在感也没那么强。我在知乎上第一次看见“江苏人为什么优越感那么强”的时候觉得不可思议。,0
贵州才是吧，不是我们穷就是说素质差??,1
?只想到牛肉丸??黑点在哪里？,0
中国劳工也在非洲大杀四方??,0
怎么说呢 中国女性和非洲男性恋爱我觉得并不能归咎到国家层面民族层面来讲问题 只能说愿意和非洲男性谈恋爱的都是底层人民,0
哈哈??看过??男生真倒霉啊,1
个人感觉:把真实写出来就是为了警惕一些无脑无智的人去触碰，说一个“虚伪”言论固然省事，就怕你说的是“虚伪”的发言，但那些傻子看不穿看不透啊，还以为是真的，被误导。所以网络公共平台还是需要人说真话的??,1
证据链不完整,0
东南亚小国人种可能和南方人差异就不大,0
关键是十月怀胎黑小孩落地，出院发现爹不见了??,0
你误判了??,0
我去国外下了？城门失火殃及池鱼。现在我住的地方都开始流脓了。??,0
日本人就是拎屌入住，有啥风险大的。国人房子、车、彩礼、婚礼等把全部家当都搭上了。,1
现在上大学，江苏各地的同学都有，感觉南京话就是最接近普通话的了，除了有点脏话。。当然你同学可能是南京高淳的，那边的话我也一点听不懂,0
为什么需要八年是三年，是国家出的费用，所以回国了，要不就在德国了。我姐去了以后去了补习班，然后考进和姐夫一起的学校。他们不是985／211学校，但是也算是学霸，年年拿奖学金那种，,0
黑人的感觉丑臭脏黑。给黑人睡过的女人就是被弄的臭脏黑一样。男人也爱干净。,1
其实，这个视频没有说到本质，黑河南人，可能主要原因是以前，火车站有很多河南口音的骗子，就2000年之后，都有，现在应该没有了，这个应该是主要原因吧，而火车站在过去是大量人口汇聚的地方，严重破坏了河南人在其他人心中的印象，而别的地方的人也不可能有更多途径了解河南人，我相信大多数人根本就不会没事主动去河南，去了解河南，所以，因为这些骗子，让大家对河南人有坏的印象，之后一些坏事情都扣在河南人身上，其实我都被骗过，遇到的版本是。车站买票，钱不够，借几块钱。帮忙买票。我给了5块，后来才知道是骗子,1
朱诺话题，有本事去喷宁波工程学院黑人事件啊，无能的郭朒在狂怒,1
写的太好了，我也就是觉得现在这个社会对同的宣扬有些太过了，对一些缺少判断力的青少年的性取向产生了影响。我今年已经快大学毕业了，按理来说三观早就已经稳定成熟了，但是去年我观了几部同性恋电影，看了一些有关同性恋的视频竟然对自己的性取向产生了怀疑，我觉得很震惊。一个天生的钢铁直男都会产生影响，更别谈现在十三四岁的小孩子,0
对啊，仔细想想得啥样的女生才能找黑人啊??,1
??在自己家乡说方言算排外，当然咯，谁让这座城市没有外地人就不行呢？看看自己老龄化成什么样了，有本事自己维持啊,1
怎么说呢，我希望大家讲什么话的时候意识到中国很大，东南中南西南那个气候完全不一样。说冬天冷的是哪，说夏天热的是哪，说宜居的又是哪。贵州就是夏天不热冬天冷没有春秋垂直升温降温，但是紧挨着的四川可不是这样，四季都比贵州热。所以没有省份说明的南方真的是一个地方吗？??,0
东北中年人经历过90年代的那一批人是有点蛮横，有些人说话没什么礼貌，但那也是受当时社会风气影响，现在早就好了，那时候去上海工作别人跟我说就喜欢你们东北人，豪爽，我想说东北人不都是这样啊????,0
上海罕见多啊，老旧租界了，有空可以查一查自己有没有日本血统,0
