text,pseudo_label
这能叫歧视吗？我在自己的国家，自己的土地上排斥外来种族，这能叫歧视吗？我这叫保家卫国,1
摸摸，没事了。建议移民到英国（你懂的(￣?￣)）,0
求求各位大佬，做个动图好不好,0
太假了，普通人被气死我信，有钱人不可能的，三万美金??稍微打点下默就可以解决的事,1
那是你们喜欢的羊大人按给你们的，然后觉的他们说的对。从头至尾国楠都木有参与。??????,0
不太喜欢答主这种论调。以为不问、不说、不支持、不反对、不接触就是理解尊重。这样的态度，其实有个名字，叫冷漠。认可的就赞美欣赏，否定的批判抵制，这是一个人活着的基本态度。花当然不会因为我的支持或者反对而变成树，但是欣赏花的人多了，才有了花园，才有了关于花的诗歌。而相反冷漠对待苍蝇蟑螂的话。。。当一件自然而然，纯洁美好的事物被冠以污名，而我们只是无动于衷，我们就是帮凶。,0
我从小在北京长大 我爱我的家乡美食 同时我也爱中国的美食 甚至世界的美食 我不会因为某一种美食不合的我胃口就大肆抨击 这种情况往往是没有良好教育的人所体现的。,0
我就说：“你想怎样？说出你的想法”你都表达了些什么？有什么想法说就行了，扯东扯西的干嘛,0
真恶心，看着都想吐,1
??????这话是事实。福建省内相互歧视的例子多了去了，我们早就习惯了。,1
广东哭都哭不出。??,0
不愧是金庸先生，思想先进???,0
浙江 还有狗腿子四川,0
另外，非洲人并不是我们的兄弟，把我们送进联合国的是欧洲，欧洲25票，三票弃权，欧洲只有一票反对，加上中法关系的升温，非洲很多法国的殖民地，自己去了解一下，非洲投的票最多，但是反对票也最多。,0
你以为苏北人在面对外省的时候态度好吗？不，别人一口一个我们江苏人，欺负别人不清楚苏北苏南的区别，在外面把自己当天龙人,1
被男同喜欢并不值得高兴，反而值得反思,0
以前不觉得咱们河南名声差，现在很多外省同事和我将俺们河南省杜新枝偷孩子，手眼通天到央媒，一个长相干瘪猥琐的叫兽洗白，我对咱们河南省的名声开始担忧，你说你一个杜新枝偷就承认了算了，害的我们其他河南人跟你遭殃，打工都没人要了！天杀的杜新枝！,1
我们河北……地域黑都黑布到,1
"“男人可以媚黑女人不行的问题，那你怎么说服她们,她们看了不管心里怎么想黑人肯定跟你刚,你可以换位思考下”我就是你说的这种心态，我讨厌双标男胜于讨厌黑人，毕竟黑人这种生物不接触就可以避免了，但这种双标男知乎到处都是，不停的给人洗脑男女有别",1
当初老师您退出文坛我是极力劝阻的,0
社达一直在理论上被批判，但是社会发展现实却是支持的，真讽刺了。,0
不必用语术诈，试试咣当不咣当可以了??,0
有些人，你尊重他，他会得寸进尺,0
女生我更不想了。。。苏北男的当街打老婆我亲眼目睹,1
后面都怕，前面才是主要的！,0
蒋光头下给十九路军同样都是不抵抗的命令，不过抗令自发抗日了。,0
事实就是早期你们异性恋先从动物身上传过来的。,0
哟，你们男性和外女结婚就不叫媚外？双标就要立正挨打！什么叫女性媚外男的就要找外女结婚？女性找外男的最近几年可没你们多！国内阳光帅气的小哥哥不好吗？人家还说中文呢。国内发展这么快，自己没钱吗？非要找个外国人改善生活？你们男性最近开始媚外啦？你自己看看找外女结婚的中国男性大部分都是些什么人？在国内花钱都找不到对象的人！你以为这些人找外女就花钱少？你以为人家外女来了就全都不跑？你以为外女不讲经济条件？人家也不愿意跟家徒四壁的懒汉过日子呀。??答主，你就憋做梦了，洋妞看不上你的，东欧妹子都不一定看得上你。你到可以尝试下找中亚妹子或者东南亚妹子。哦，对了，东亚妹子会要你改信教的。,1
可能觉得自己镶过金吧??,0
地域黑和分裂国家的汉奸没有区别,1
我就纳闷了，怎么又是一个匿名账号，现在都学会反串黑了,0
海南最没存在感了??,1
知乎很多东北人喜欢代表北方，挑起南北对立，把东北出现的负面新闻甩锅给南方人或南方系，总之不夸东北（黑龙江）的就是南大人，就是南方系媒体，赢麻了,0
所以嘛，不计较，欢送，把她们送回现代人发源的土地去,0
艾，约疱嘛，梅事儿的，感染率为淋，疣没什么大不了的,0
凡是美国人做的，我们坚决不做。凡是美国人不做的，我们坚决做。某些pink自以为自己爱国，理性，殊不知他一切行为的标准反而慢慢变成了以美国为准，被美国牵着鼻子走，失去了自己的意志。可悲,1
杨笠们嘴里的普却信??????,0
希望他们嫁给默以后都去非洲吧，不要待在国内，看着觉得蛮恶心的，跑爹默竟然也有人中国女人愿意嫁也不配当中国人,1
综合上述评论、上海这轮第一，大家没意见吧？,0
你还能代表全国？如果没有你国民素质至少上升两个档，你快去自**吧,1
国男的包容大度一直都是这么无私，eg使劲浪，反正有老实巴交的国男兜底囧,0
他说的是低温你跑出来认什么？??,0
那么基佬能接受和女人make love吗？,1
歪，110嘛，对，有人打我！就是我刷着知乎他就打我，一直打！是个绿色的??,0
这些权利不应该你们自己去争取吗，我们保持“冷漠”碍着你们平权了？是你们一边忍受不了社会对你们的不公，一边又因为自己懦弱不敢站出来发生，只好借助那些可怜同性恋的人的力量在背后默默赞同吧,1
小朋友，别再给河南招黑了,1
我也是去读书的??,0
不要偷换概念，答主说的讨厌吃香菜对应的是穆斯林讨厌吃猪肉，当然他们讨厌别人吃猪肉也没有问题，问题是因为他们不吃因此要禁止别人也不吃，这才是问题所在。喜欢和讨厌都是个人主观上的情绪感觉，这个是没有任何问题的，如果因为这种个人情绪表现为其他方式（比如辱骂，比如阻挠）因而妨碍或者伤害到别人了，那么就是错的,0
emm我是个女生，所以没办法回答你的问题，但我想说说我的想法。同性恋这个圈子的确乱象频生，但这不大能定义所有的同性恋。??我没想谴责你对同性恋的厌恶，只是也想让你知道同性恋不全是恶心的。至少不歧视，至少浅浅地尊重就好。我也曾对关系特别好的舍友产生过像是喜欢的感情，那只是一种单纯地喜欢罢了，友情之上恋人未满，表白了，对方觉得惊讶（第一次被女生表白）也表示理解。我与她说了，我只是想告诉她，我好像喜欢她，她能算是我的初恋。虽然到后来慢慢地发觉这其实并不是爱情，但我们的关系也更亲密了，前段时间我还给她出谋划策追她的初恋呢，当然成功了，也当然来的快去的也快啦??真没想到她提分手得这么快。其实人的感情就是这么简单嘛。别吵架别吵架,1
作为一个青海人，我想说青海人也会歧视所有外地人，除了甘肃人，我想是因为甘肃方言和青海方言还有生活习惯很像吧，我们一般叫甘肃人“老甘”,1
“偶系东北黑涩会，里地鹅几在我手萨”呐！我没冤枉你吧，一听口音就知道是东北的，东北都是黑s会??,1
我想我们都是中国人吧？我们是在中国的土地上，用着中国的网络上中国的app在用中文讲话吧？中国官方对txl的态度不是一直都不咋地嘛？连一些有关同性恋的小说改编电视剧都要先披上兄弟情的外衣才能通过审核，为啥会有人觉得在中国txl是政治正确呢？我想同性恋是政治正确的讲法只是反同的人把在美国常见的政治正确的坏帽子扣在了txl的身上以此来反驳同性恋，不过是维护自己价值观和抹黑txl的手段罢了。,0
如果国家在这方面立法就真的好了。,0
别的评论都被他删差不多了你和他说这么多有用？,0
又不是没看过动作片，我当然知道，但是，菊花里全是翔，默与媚默女居然乐此不疲，令人难以理解。一旦看到这种镜头，我全都快进跳过，心理不适，对这种行为毫无兴趣，更没有试的冲动。另外，某些国家的默的艾滋感染率很高，无套内x会带给女人很大风险，接盘者可能招至无妄之灾，这才是真正恐怖之处。中国的艾滋呈扩散趋势，同胞们不要乱约了，珍爱自己，珍爱家人。,1
那tmd倒是嫁过去啊，在中国生活算怎么回事啊,1
华夏民族和非洲民族智商相差1000代人的进化（某文章上看到的），按照进化论来说，目前虽然没有进化到生殖隔离的地步，但终究有一天可能也会进化成不同的物种。就像人和猪，从一最开始，也是一样的祖先。??,0
河北也开始了，刚看到个热门话题，河北是如何一步步沦落到最贫困省份的,0
我感觉浑身的细胞都在反感同性恋，就像人不喜欢吃屎一样，你说能吃吗你要想吃也不是不能吃反正吃不死，但正常人就是反感吃屎，为什么反感呢？吃屎又吃不死人为什么反感呢？你能给个理由吗？你要说臭完全可以加些调味品闻不出来不就好了，如果某一天社会认可了吃屎并且要尊重吃屎的行为，你会吃吗？我反正不会你可能也不会，但你要尊重吃屎的人，因为社会主流都认可了你不认可就显得你很低级跟不上社会，人是害怕跟社会脱节的所以假装一下也无可厚非，但内心是反感的就算你认为自己文化高思想觉悟高但潜意识里还是反感的。,1
可能南方也分为东南和西南,0
种族歧视又不是贬义词,1
监狱医院？监狱墓地！,0
黑人基本都没 叠的，结婚的很少,1
命运多舛??,0
对啊，从根本上讲就是资源问题啊,0
牛头人听说自己女朋友跟别人玩的花还很兴奋,0
所以你认为我所说的那些腐女太偏激了是在瞎bb,1
不用万一，是百分百,0
我很喜欢香港老电影，在香港老电影里，一众明星称呼老外叫“洋鬼子”，他们制作这样的电影放映，从来不会在事前事后说一句：没有歧视老外的意思。连香港这种当时处在英殖民统治下的地方，都没有的所谓下对上（黄人对白人）的种族歧视禁忌，为何我们现在说话就怕种族歧视？,1
虽然非洲确实艾滋病比较严重了但也没有30%??,1
河南真的惨，黑东北还有好多东北人来反对，黑河南真的就黑到底了,1
嘴上没得尖锐湿疹的??????，说话就是硬气??,1
极端女权？极端男拳？现在会来说团结了啊？想的挺美的啊！,0
我没那么高尚，你炮轰我一个人我就花钱买他全家信息，然后我上新闻，他全家下户口??,0
关键是被默玩腻了就会找老实人接盘,0
说到底还是资本的坏，为了利益恶意宣传不择手段,1
出国了算了，别让老外觉着中国女性都是她那得行，招黑。,1
你想啥呢？艾滋病现在完全能做到通过药物控制到和正常人无异，但该传染还能传染，要不哪来那么多结婚后才发现自己被伴侣传染的案子，最后还都不了了之了，正常人得罪谁了？,1
我也是。我及其厌恶黑皮。与其为伍就是自甘堕落????,1
错 上海排外排的是中国人，外国人可一点也不排，全供起来舔,1
不是河北没黑点，是隔壁几个兄弟太强??,0
可拉倒吧，黑浙江的够少了,1
不是不可以在有外地人的地方说上海话，是明知道对方是外地人还讲上海话。来秀所谓的优越感。其实吧，除非人类灭亡，不然歧视文化永远不会消失。,1
不喜欢不接触就可以了，喜欢不喜欢确实是每个人的自由。一个东西做到所有人态度一致本就不可能,0
强迫认可的意思是改变别人的想法，不认可就喷。,0
涉外婚姻，男性外娶占六成,1
呵呵，果然机智～,0
你不喜欢他接触你应该当场说出来,0
所以你喜欢一个人就是馋ta身子？就是想上ta??,0
我都不会说，我是河南的，在东北也依然遇到过地域歧视。我邀请同学到我家做客，然后她妈不同意，因为是河南的啊，可是她说她妈并没有认识的河南人。到最后来了，感觉我们这边感觉还不错。还有一次是跟朋友吃饭，刚认识的一个人说他在二七那边看到有人偷井盖，无语了，我那么多年天天去二七也没看到过咋让他碰上了。幸好这还算个别的，不过我对这鄙视链也是。。。,0
地域黑民族黑都挺多的，还有地域偏见，这个最大的应该还是河南东北广西，再加上边境省份??,1
江苏脾气就这样，小市民思想比较重,1
有一说一真的不会有审美隔离吗，例如黑人白人看我们都是黄皮，我们也分不太清黑人白人的样貌，甚至觉得黑人严重不符合我的审美,1
其实我对男同怎么的还真没什么看法，我歧视的是在到处瞎叫唤男男的女生，她们没觉得自己很恶心吗？还好意思指责别人鄙视同性恋，都是她们整臭的??????,1
你的逻辑在哪，我说一个艾滋病患者，女的辐射面大于男的这个结论不正确，你还想狡辩，你也就知道狡辩了。,1
对B男性是从生理到社会到心理的不适，对B女性只是单纯的心理引发生理接受不了。,0
看你这种人的文章瞬间戾气重了250倍,0
我就是南方人 我就揍过英国佬??,1
对东北来说东北以南都是南方，对广东来说广东以北都是北方??,0
大哥??，你的好闺蜜要嫁给默，和默私奔去非洲当妾，你他妈的不给你好闺蜜来十几个耳巴子，把她打醒？如果你说：不会，我支持她追求爱情。那当我没说，因为你们可能是塑料姐妹情,0
可是我爷爷姥姥是山东人 我奶奶是江苏人呀??,0
黑就黑吧，地域黑是慣例無可避免，黑呀黑就習慣了，不在乎了。,1
由于违反XXXXX，该用户已被永久禁言??????,0
我也是，被他们打过,0
用井盖敲诈,1
崇拜黑人的跪族男孩至少不给黑人生猴子的吧？??,1
上海歧视有，但是说实话不歧视河南，受害者主要是苏北和安徽。,1
那就由她去??,0
不用怀疑，就是这样,0
你让我抱个黑娃说这是我外甥，我没这个脸,0
不犯法就行了,0
把评论区说急了,0
湖南人真的很有才，起码广东这边很多湖南老板领导什么的??,0
那是他们搞错了，江浙人民黑啥东北，南方系要的就是挑起地域间的矛盾，他们被带了节奏。,1
讲真的爱谁谁吧。反正不是自己亲戚朋友家女孩，关我卵事。但是我觉得嫁给黑人的国女要自觉点，跟男人去国外，更不要把孩子生养在国内。否则你污染自家祖宗基因别人管不着，但是黑二代污染别人家的基因就说不过去了。,1
绝大部分黄黑混血上不了高中，甚至到了初中就会辍学，反正就是街溜子预备队。,1
嘿硅嘿硅嘿硅嘿硅嘿硅嘿硅嘿硅,0
也没人不让你们搞基啊，这不就是你们的权利？你搞你们的，我们反感我们的，你们有搞基的自由，我们有反感的自由。我们反感妨碍你了？那是不是全天下的人都得喜欢你？,1
当然→_→，女看男的话。。。按照上面的换着来就是了，现在的社会，男女都把性想的太过于美好了，而他们则只看到了同好的一面,1
搞地域歧视的都是憨憨,1
你们东北人最自卑了,0
齐齐哈尔人，也考来了抚顺，也听过类似的言论，呵,0
互喷不就是最好的抵制方法吗??,1
上海河南广东，春晚三大被黑惨烈的地方，春晚一向这么搞很恶心的,1
因为台湾富裕，想嫁到台湾吧,0
哈哈哈哈哈哈！！！！黑女都找到中国大使馆去了？津巴布韦总统都点名了？哈哈哈哈哈哈哈！！！！！这打脸太厉害了。必须关注。,0
??太自信了，有几个敢明说自己找过黑人男朋友的，这话一出口，多少人转头就走！还有男女比例差别没那么大。,0
这么说您是个娘们？??,1
对我们这些不外娶不外嫁的人而言，黑人、白人有什么区别？就是个人种不同、文化背景不同、过往历史不详的陌生人。我们又不混外企圈，为什么要在社交圈子里引入这些只有风险、没有收益的陌生人？这是个理性选择，不是种族偏好的问题。,1
哈哈哈哈……我也是……太逗来……感觉说撒都会被歧视……,0
黑子们四五月份骂上海，六月份骂唐山，七月份骂南京，八月份喷海南，,1
确实，现实中根本遇不到，有愤怒也发泄不出去啊。只能在网上刷到这种新闻然后重拳出击。你问问身边的女生，有几个能接受黑人男友的??,1
这才是真正的社死…网上嚷嚷不如线下的彻底遗忘,0
那一定是新疆???,0
咱就是南蛮后代,0
嗯，地域黑都是蠢或者坏！！,1
好家伙，这就抓到一只,0
这你不先透了再甩啊,0
接受程度差不多就是日韩甚至于越南泰国，白人，黑人，动物。。这样子，不考虑文化差异纯粹的就是发自本能的排斥。,1
我去杭州玩 刚出铂丽酒店没一百米 可能因为我在和边上的同学用东北话交流 两个东北人真是罪大恶极 杭州警察立刻把我俩拦下来盘问并且要求查身份证 你要非得说没有歧视我也没招 我说的要是萧山话他会拦我们吗,1
你父母完全就是为了繁育你这种人才在一起的是吗，谁规定你们就是对的，就因为能生孩子就是对的了？那谁说了我们就是错的，我们真心相爱在一起为啥就是扭曲,0
心理不适是其一，其二，怕死。老命只有一条，犯不着用自己的小命去测试对方有木有……艾？,0
东北确实，你要是辩的太有理，对面就不用理由嗯骂东北，偏见是刻在骨子里的,1
大兄弟，小心被地域黑当成靶子，毕竟回族在中文网络上名声不太好,1
说实话，我认识的苏北男生多数确实不想和他相处。,0
北京山东河北最歧视东北了,1
拳师的台词我都预备好了：歧视，歧视，还是歧视??,1
又是个体推及全体，以及双标。所以应证了上海被排外多么严重啊,1
再加个有一口流利的南京话,0
留学，才不留学，来就当教授。,0
没事儿哥们，你这一看就是祖国哪里需要你，你就去哪里，我相信生活中不会有人看不起你的,0
我一个女的都这样觉得，要我的朋友里面有跟黑人谈恋爱的，直接变成塑料，说不定都有可能撕破脸，并且和黑人妹子谈过恋爱的男生，我这个女生也本能接受不了，以前觉得黑人不能一棒子打死，现在只要看见黑人有关的话题，骂黑人的还行，只要是说黑人好的，直接屏蔽??,1
同性恋他们本身就跟社会格格不入，在这种环境下，思想不同常人也是很正常。,0
虽然有点绕、但还真有道理,0
你的重点放错了，我的意思是那些人太偏激了????,0
钓鱼佬永不空军??,1
《嫁到非洲》是什么风气？,0
苏北人说我们江西是韩国人??，礼貌吗,0
她们不是单纯，是真的蠢,0
沈大的关系有点不好说，剪不断理还乱,0
歧视三非黑人，素质道德低下黑人是正确的。而且即使不歧视，那作为一个普通人逃避风险是人之常情 在这样一个黑人留中背调这么不靠谱的情况下，远离他们就是普通人唯一能做的了。不认识排挤恶，那社会就没有向善的动力。,1
突然想起以前看到的，好些中国男的去非洲援建，然后在当地留下了大量混血儿跑路，不知道这些男的回来会不会也有艾滋……,1
上海笑而不语,0
格局小了，国女都是喜欢找黑人约p，找国男接盘??,1
黑龙江籍新疆人不服,0
只要她们移民出去就行，别留在中国传染艾滋病，这不是害人么？??,1
南方人黑陕西可能是因为江苏、浙江陕西人很多，跟河南一样出一两个人啥b就会扯到整个陕西身上,1
你这样说话是在给河南招黑??,1
现在全国基本都是达成共识的反黑情绪??你说啥时候人民这么统一，难道不是因为被折腾久了,1
害就是淮河流域嘛，传统的农业区，自然灾害频发，经济教育资源都匮乏，文化素质整体也不高，而且距离他们最近的发达地区就是长三角，去了之后又犯事，自然就被歧视了,1
不接受也无所谓，有接受的也有不接受的。但是骂出来就不对了，拿答主你的【吃辣】的例子来说，不喜欢吃辣还骂别人吃辣的人，恐怕用【稍显粗鲁】来评价太不痛不痒了。,1
我总觉得东部沿海对西部内陆有很深的恶意……跟你差不了多少。很多人可能觉得我们老实好欺负吧,1
小红书根本不给我推送你叫我怎么看？??,0
统一回复一下，评论太多了哈 ，我的一一看完了，有好有坏吧看得出来部分人在生活中过的都不愉快，如果这种方式可以让大家心里好受一点，我也无所谓。,0
河南是中原文明/华夏文明的起源地啊??,0
现实里可不是这样的，至少我认识的安徽人民，都是不惹事，不怕事，遇到挑衅，生死看淡不服就干????,0
是个正常人不应该都狂怒吗？,0
我是女的，说实话，如果我找的男朋友交往过黑人女朋友我拔腿就跑，接受不了。交往黑人男友的女生我也做不了朋友，还是拔腿就跑。,1
其实大街上偶尔看到黑人白人都很正常，但主要黑黄混血，看到了就觉得恶心，不伦不类的??,1
引进就是恶毒的诅咒,1
gou都不去。来bj看老子不大斯你??,1
不用理他们，他们就是一群闲人，长舌妇一般喜欢指手画脚别人的人生。,0
不用谢，我也是为了自己利益着想w一是多一对幸福的基佬就少两个同妻，二是容不下LGBTQ的保守主义社会同样容不下hentai play。作为一个绅士魔法师，我觉得我的逻辑是完美自恰的ww,0
因为很少人会在职场中出柜吧??如果基佬都没工作没社会贡献咋活呢,1
对啊，正常人根本不可能喜欢的玩意，有的人就是爱，你说是不是性癖是啥??有的人就是喜欢日小动物，鸡狗蛇，都见过??,0
介绍下你的姐妹给黑人认识下？,0
你形容的好生动,0
??大多都到非洲生活了！,0
你对工程师有什么误会，只有在车间从事生产的技术人员和工地看图纸的才叫工程师？??制造业种类那么多，做软件的电子的搞航天的都是工程师，怎么就又毒又累了,0
这点没得洗有时候塔利班是对的,0
大兄弟的，试纸网上有卖，你自己拿点她的体液自己测啊，准确率百分之99以上,0
陕西人又穷又自大,1
浙江人 觉得年轻一代江西人很不错呀,0
别闹了，好像黑吉辽配单独提名一样??，那边一个多亿人都是被当做“东北”来整体进行辱骂的，是的就是辱骂??,1
你真以为同性恋都是单纯为了追求与众不同而已？我当时发现自己是同性恋的时候人们比现在保守好多，我因为害怕还拼命想要掰直自己，尝试过健康干预性取向，后来没成功而已，我花了好长时间才能坦然。当然我也不想qj你的想法，我只是觉得你不会尊重人很可悲。,0
上海那能叫地域黑？你怕啥搞不懂这词啥意思吧,1
我承认我是一个有着种族歧视的人，我只喜欢黄种人????,1
还是有敢的人的，之前看过，但是硬碰硬犯法呀！！！,0
爆菊太可怕了，死变态啊??,1
浙江江苏福建?,0
请视说这种人为弱智,1
人家就读错个子，你意见都那么大，你想想为什么那么多人黑河南了吧,1
使用大熊猫提前筛选对线目标查看动图,0
中国一带一路战略就是投资那些地方，到时候收益大部分在资本巨头手里，我们就是可以吃一下发展福利。说不定人家抓住机会过的比我们好呢,0
看你这么卖力气，特意回来给你点了个赞同,0
最后两个的顺序可以斟酌的。,0
没事，为了艾，这能忍??,0
到時我們像法國一樣被黑化就你就知錯了，我們就是擔心這個。你還別說，我們思想還真有些血統論,0
找黑人本身并没错，被甩了找人接盘就太坏了,1
还整个中国，，长三角，珠三角那个城市不把大庆吊起来打的？,0
有钱哪里的妹子都喜欢你,0
毛爷爷领导这么多年妇女解放运动，就是为了让中国女性有尊严地活，看到现在的情况，不知他作何感想??,0
我就是黑龙江人，都是东北人你这么说黑龙江，我也是服了。沈阳很多人都知道，玩的话去抚顺去鞍山啥意思你不会不懂吧，为什么？便宜啊。敢情那些小姑娘都是黑龙江来的呗~黑龙江农业发达，很多农村农场的收入水平比城市高多了。辽宁这边除了沈阳大连营口，其他地方真没有比黑龙江好太多，工资水平，半斤八两而已。鞍钢本钢这种巨亏国企并没比龙煤集团 大庆齐齐哈尔强到哪里。原本觉得你这人挺实在的，结果扛着枪窝里横，真让我小看你了,0
